"user_id","cookie_user","Item","title","description","resource_url","link","tags","Year","Month","Day","Hour","Minutes","Seconds","Day of Week","date","topic_coverage","view_coverage","weight","community_id","type","name","scope_topic_coverage"
"cd330929-4725-441b-8091-5e4581722bd5","8f186466-3edb-6cb2-e1a6-8eb6e4b09fa2","62d358fb-6bb7-4c26-a86d-9250390dba3e","Rembrandt's Girl at a Window","<br><p>Rembrandt Harmensz van Rijn, A Girl at a Window, 1645, oil on canvas, 32 x 24 in. (81.6 x 61 cm), (Dulwich Picture Gallery, London). Speakers Pippa Couch, Rachel Ropeik.</p><p>It is an educational content by <a href=""http://www.khanacademy.org/"" target=""_blank"">Khan Academy</a>, site that contains a wide variety of educational videos.</p>","https://didactalia.net/comunidad/materialeducativo/recurso/rembrandts-girl-at-a-window/62d358fb-6bb7-4c26-a86d-9250390dba3e","http://www.youtube.com/watch?v=xSixUm1cXSw","rembrandt;dulwich picture gallery;rembrandt harmenszoon van rijn;dutch golden age painting;baroque painting;baroque;dutch golden age;dutch golden age painters;dutch golden age printmakers;a girl at a window;girl at a window;oil paint;",2017,9,14,6,12,10,"Thursday","2017-09-14T06:12:10Z",0.04229074889867841,0.041666666666666664,11.727,"f22e757b-8116-4496-bec4-ae93a4792c28","resourceVisited","pablo picasso",0
"cd330929-4725-441b-8091-5e4581722bd5","8f186466-3edb-6cb2-e1a6-8eb6e4b09fa2","ed677bfa-7cf3-4849-afe1-fdc2487fa34d","Rembrandt's Bathsheba at her Bath","<br><p>Rembrandt van Rijn, Bathsheba at Her Bath, 1654, oil on canvas, 56 x 56 in (142 x 142 cm) , Musée du Louvre, Paris. Speakers Drs. Beth Harris and Steven Zucker.</p><p>It is an educational content by <a href=""http://www.khanacademy.org/"" target=""_blank"">Khan Academy</a>, site that contains a wide variety of educational videos.</p>","https://didactalia.net/comunidad/materialeducativo/recurso/rembrandts-bathsheba-at-her-bath/ed677bfa-7cf3-4849-afe1-fdc2487fa34d","http://www.youtube.com/watch?v=wsL4Uh0BrQw","rembrandt;bathsheba;louvre;rembrandt harmenszoon van rijn;dutch golden age painting;baroque painting;baroque;dutch golden age;dutch golden age painters;dutch golden age printmakers;bathsheba at her bath (rembrandt);old testament;david;paintings by rembrandt;paintings of the louvre;paintings with biblical themes;",2017,9,14,6,11,40,"Thursday","2017-09-14T06:11:40Z",0.04229074889867841,0.025641025641025647,12.048,"f22e757b-8116-4496-bec4-ae93a4792c28","resourceVisited","pablo picasso",0
"cd330929-4725-441b-8091-5e4581722bd5","8f186466-3edb-6cb2-e1a6-8eb6e4b09fa2","da948777-3e13-4173-9368-657ac25e4e70","Use Simple Integer Equations to Solve Real-World Problem? At grade","Solve real-world dilemmas by using simple integer equations<br/><p>It is an educational content of <a href='http://www.ck12.org/' target='_blank'>CK-12 Foundation</a> (to access some of the CK-12 contents you must be logged in).</p>","https://didactalia.net/comunidad/materialeducativo/recurso/use-simple-integer-equations-to-solve-real-world/da948777-3e13-4173-9368-657ac25e4e70","http://www.ck12.org/arithmetic/Integers-that-Represent-Different-Situations/lesson/Use-Simple-Integer-Equations-to-Solve-Real-World-Problems/","simple integer equations;solve real-world problems;arithmetic;difference;integer;integer equations;integers;",2017,9,13,7,36,30,"Wednesday","2017-09-13T07:36:30Z",0.04229074889867841,0.056390977443609026,19.186,"f22e757b-8116-4496-bec4-ae93a4792c28","resourceVisited","",0.04229074889867841
"cd330929-4725-441b-8091-5e4581722bd5","8f186466-3edb-6cb2-e1a6-8eb6e4b09fa2","da948777-3e13-4173-9368-657ac25e4e70","Use Simple Integer Equations to Solve Real-World Problem? At grade","Solve real-world dilemmas by using simple integer equations<br/><p>It is an educational content of <a href='http://www.ck12.org/' target='_blank'>CK-12 Foundation</a> (to access some of the CK-12 contents you must be logged in).</p>","https://didactalia.net/comunidad/materialeducativo/recurso/use-simple-integer-equations-to-solve-real-world/da948777-3e13-4173-9368-657ac25e4e70","http://www.ck12.org/arithmetic/Integers-that-Represent-Different-Situations/lesson/Use-Simple-Integer-Equations-to-Solve-Real-World-Problems/","simple integer equations;solve real-world problems;arithmetic;difference;integer;integer equations;integers;",2017,9,13,6,8,5,"Wednesday","2017-09-13T06:08:05Z",0.04229074889867841,0.03088803088803089,19.186,"f22e757b-8116-4496-bec4-ae93a4792c28","resourceVisited","",0.04229074889867841
"cd330929-4725-441b-8091-5e4581722bd5","8f186466-3edb-6cb2-e1a6-8eb6e4b09fa2","918e81bf-f468-4fb0-a8f3-6c93d328ca5a","Math Division Problems","<p>Solve these math division problems.</p><br/><p>It is an educational content by <a href=""http://www.jetpunk.com"" target=""_blank"">JetPunk</a>, site that contains a wide variety of quizzes.</p>","https://didactalia.net/comunidad/materialeducativo/recurso/math-division-problems/918e81bf-f468-4fb0-a8f3-6c93d328ca5a","http://www.jetpunk.com/user-quizzes/24138/math-division-problems-quiz","math division problems;division problems;operation (mathematics);arithmetic problems;arithmetic;division (mathematics);division;elementary arithmetic;quotition and partition;",2017,9,13,6,7,4,"Wednesday","2017-09-13T06:07:04Z",0.04229074889867841,0.027777777777777783,13.519,"f22e757b-8116-4496-bec4-ae93a4792c28","resourceVisited","",0.04229074889867841
"cd330929-4725-441b-8091-5e4581722bd5","f6b651f8-ba8c-8f52-3c8a-4729b5607455","143fd196-2fcf-469d-9ef8-f42669ea56e4","Picasso's Les Demoiselles d'Avignon","<br><p>Pablo Picasso, Les Demoiselles d'Avignon, 1907 (Museum of Modern Art)</p><p>It is an educational content by <a href=""http://www.khanacademy.org/"" target=""_blank"">Khan Academy</a>, site that contains a wide variety of educational videos.</p>","https://didactalia.net/comunidad/materialeducativo/recurso/picassos-les-demoiselles-davignon/143fd196-2fcf-469d-9ef8-f42669ea56e4","http://www.youtube.com/watch?v=fy2TlYnYIzA","picasso;moma;pablo picasso;cubism;avant-garde;three-dimensional space;modern art;edwardian era;abstract art;surrealism;josé ruiz y blasco;real academia de bellas artes de san fernando;assemblage (art);collage;plastic arts;20th-century spanish painters;cubist artists;modern painters;still life;paintings by pablo picasso;museum of modern art;les demoiselles d'avignon;oil painting;traditional african masks;picture plane;proto-cubism;spanish art;proto-cubist paintings;nude art;",2017,9,12,16,4,30,"Tuesday","2017-09-12T16:04:30Z",0.04229074889867841,0.06995073891625612,12.396,"f22e757b-8116-4496-bec4-ae93a4792c28","resourceVisited","oil painting",0
"cd330929-4725-441b-8091-5e4581722bd5","f6b651f8-ba8c-8f52-3c8a-4729b5607455","3c7e6a2d-320f-4f10-9964-b430c925b743","Picasso's The Reservoir, Horta de Ebro","<br><p>Pablo Picasso, The Reservoir, Horta de Ebro, oil on canvas, summer 1909, 24-1/8 x 20-1/8"" (MoMA, fractional and promised gift)</p><p>It is an educational content by <a href=""http://www.khanacademy.org/"" target=""_blank"">Khan Academy</a>, site that contains a wide variety of educational videos.</p>","https://didactalia.net/comunidad/materialeducativo/recurso/picassos-the-reservoir-horta-de-ebro/3c7e6a2d-320f-4f10-9964-b430c925b743","http://www.youtube.com/watch?v=IXtreNuEC-Q","picasso;painting;museum of modern art;pablo picasso;cubism;avant-garde;three-dimensional space;modern art;edwardian era;abstract art;surrealism;josé ruiz y blasco;real academia de bellas artes de san fernando;assemblage (art);collage;plastic arts;20th-century spanish painters;cubist artists;modern painters;still life;paintings by pablo picasso;horta de ebro;picasso's african period;the reservoir;oil painting;moma;",2017,9,12,15,58,21,"Tuesday","2017-09-12T15:58:21Z",0.04229074889867841,0.05316742081447963,12.316,"f22e757b-8116-4496-bec4-ae93a4792c28","resourceVisited","oil painting",0
"cd330929-4725-441b-8091-5e4581722bd5","f6b651f8-ba8c-8f52-3c8a-4729b5607455","9a3299b8-2270-41ce-beec-8f0b81b9e584","Picasso's Guernica","<p>&nbsp;</p>\n\n<p>Picasso, Guernica, oil on canvas, 1937 (Museo Reina Sofia, Madrid). Speakers Dr. Steven Zucker, Dr. Beth Harris.</p>\n\n<p>&nbsp;</p>\n\n<p>It is an educational content by <a href=""http://www.khanacademy.org/"" target=""_blank"">Khan Academy</a>, site that contains a wide variety of educational videos.</p>\n","https://didactalia.net/comunidad/materialeducativo/recurso/picassos-guernica/9a3299b8-2270-41ce-beec-8f0b81b9e584","http://www.youtube.com/watch?v=K1_qjc4SQlk","picasso;guernica;pablo picasso;cubism;avant-garde;three-dimensional space;modern art;edwardian era;abstract art;surrealism;josé ruiz y blasco;real academia de bellas artes de san fernando;assemblage (art);collage;plastic arts;20th-century spanish painters;cubist artists;modern painters;still life;paintings by pablo picasso;museo nacional centro de arte reina sofía;guernica (picasso);oil painting;bombing of guernica;exposition internationale des arts et techniques dans la vie moderne;cubist paintings;war paintings;political art;",2017,9,12,15,57,56,"Tuesday","2017-09-12T15:57:56Z",0.04229074889867841,0.030303030303030283,18.244,"f22e757b-8116-4496-bec4-ae93a4792c28","resourceVisited","oil painting",0
"cd330929-4725-441b-8091-5e4581722bd5","f6b651f8-ba8c-8f52-3c8a-4729b5607455","e45e2cab-0936-4eb2-8614-6acbbe7311cf","Othello by Hannah Tompkins. Description of painting (Shakespeare Art Museum)","<p><img alt="" Othello by Hannah Tompkins. Description of painting (Shakespeare Art Museum  )"" src=""https://contentmapas.didactalia.net/imagenes/Usuarios/ImagenesCKEditor/5d1dada8-e23b-499e-aa70-66ad03aedbc4/44b6024a-8652-46c4-96d6-fa2cd24932e3.jpg"" title="" Othello by Hannah Tompkins. Description of painting (Shakespeare Art Museum  )"" />The central figure is Othello whose features are inflamed with the fiery passion of consuming jealousy. Even the whites of his eyes are afire. Part of the description of painting . Oil on canvas 25"" x 30"" <em>by Hannah Tompkins</em><br />"" I kissed thee ere I killed thee.. no way but this, Killing myself, to die upon a kiss.""     (V. ii.)</p>","https://didactalia.net/comunidad/materialeducativo/recurso/othello-by-hannah-tompkins-description-of/e45e2cab-0936-4eb2-8614-6acbbe7311cf","http://shakespeare-art-museum.com/Oils/122.html","painting;othello;oil;hannah tompkins;canvas;othello (character);jealousy;desdemona;love;asesinato;murder;yago;shakespearean tragedy;",2017,9,12,15,54,6,"Tuesday","2017-09-12T15:54:06Z",0.04229074889867841,0.03125,15.775,"f22e757b-8116-4496-bec4-ae93a4792c28","resourceVisited","painting",0
"cd330929-4725-441b-8091-5e4581722bd5","8f186466-3edb-6cb2-e1a6-8eb6e4b09fa2","947b24fc-99ab-4d36-a224-a9c05adf0e1f","Medieval English History","<p>Name these historical facts about England from the 5th to 15th centuries.</p><br/><p>It is an educational content by <a href=""http://www.jetpunk.com"" target=""_blank"">JetPunk</a>, site that contains a wide variety of quizzes.</p>","https://didactalia.net/comunidad/materialeducativo/recurso/medieval-english-history/947b24fc-99ab-4d36-a224-a9c05adf0e1f","http://www.jetpunk.com/quizzes/medieval-english-history","medieval english history;alfred the great;list of monarchs of wessex;anglo-saxons;beowulf;grendel;grendel's mother;feudalism;lord;vassal;fief;william the conqueror;monarchy of the united kingdom;robert i;duke of normandy;norman conquest of england;normandy;duchy of normandy;harold godwinson;battle of hastings;bayeux tapestry;domesday book;anglo-saxon chronicle;edward the confessor;thomas beckett;archbishop of canterbury;pope alexander iii;richard i of england;duke of aquitaine;magna carta;john;king of england;edward i of england;jews;ancient near east;black death;yersinia pestis;geoffrey chaucer;the book of the duchess;battle of agincourt;henry v of england;longbow;wars of the roses;house of lancaster;house of york;richard iii of england;tower of london;",2017,9,12,12,2,52,"Tuesday","2017-09-12T12:02:52Z",0.04229074889867841,0.03637611530542208,14.521,"f22e757b-8116-4496-bec4-ae93a4792c28","resourceVisited","",0.04229074889867841
"cd330929-4725-441b-8091-5e4581722bd5","8f186466-3edb-6cb2-e1a6-8eb6e4b09fa2","d436d604-d2d0-43b7-8e0e-61d9ad326af6","Stories of England and her forty counties (International Children's Digital Library)","A story about England and her forty counties written by Thomas Geldart.<br/><p>It is an ebook from <a href='http://www.childrenslibrary.org/' target='_blank'>The International Children's Digital Library</a>, a project of the <i>ICDL Foundation</i> in collaboration with the <i>University of Maryland's Human-Computer Interaction Lab.</i></p>","https://didactalia.net/comunidad/materialeducativo/recurso/stories-of-england-and-her-forty-counties/d436d604-d2d0-43b7-8e0e-61d9ad326af6","http://www.childrenslibrary.org/icdl/BookReader?bookid=gelstor_00360582&twoPage=false&route=all&size=0&fullscreen=false&pnum1=1&lang=English&ilang=English","stories of england and her forty counties;stories of england;counties of england;thomas geldart;children's literature;county;",2017,9,12,12,1,52,"Tuesday","2017-09-12T12:01:52Z",0.03436123348017621,0.03333333333333333,29.308,"f22e757b-8116-4496-bec4-ae93a4792c28","resourceVisited","",0.03436123348017621
"cd330929-4725-441b-8091-5e4581722bd5","8f186466-3edb-6cb2-e1a6-8eb6e4b09fa2","360d8e05-d1c0-448f-8962-4761c52450da","Travelling around England","Travelling around England","https://didactalia.net/comunidad/materialeducativo/recurso/travelling-around-england/360d8e05-d1c0-448f-8962-4761c52450da",,"travelling;around;england;mda;",2017,9,12,12,1,38,"Tuesday","2017-09-12T12:01:38Z",0.03436123348017621,0.034482758620689655,25.019,"f22e757b-8116-4496-bec4-ae93a4792c28","resourceVisited","",0.03436123348017621
"cd330929-4725-441b-8091-5e4581722bd5","8f186466-3edb-6cb2-e1a6-8eb6e4b09fa2","bb929443-a6d0-4c3e-9142-c09b106b65f3","Chance and probability","<p>&quot;Learning unit on chance, probability, their mathematical representation and their impact on daily life &quot; Fuente: <a href=""http://contenidos.proyectoagrega.es/buscador/BuscarAvanzadoCU/MostrarResultadosImagenesPrepararRetornoDetalleImagenes.do?idioma=en&amp;buscContenido=&amp;pagina=1&amp;formato=&amp;recurso=&amp;procesoCognitivo=&amp;contexto=&amp;edad=&amp;autor=&amp;diaPublic=&amp;mesPublic=&amp;anyoPublic=&amp;c_s_secuencia=&amp;valoracion=&amp;enlaceTaxSelec=&amp;identificadorODE=es_2008050563_0231100&amp;tipoVisualiz=CON_IMAGENES&amp;nodoDestino=&amp;enlaceComuSelec=&amp;tipoBusqueda=03&amp;enlaceTodoAgrega=&amp;tipoLayoutBuscador=NEUTRO&amp;idTesauro=&amp;nomTesauros=&amp;idTesauroSug=&amp;nivelAgreg=3&amp;destinatarios=&amp;keyword=&amp;numeroResultados=10000"" target=""_blank"">Proyecto Agrega</a><br />\n<br />\n<strong>Chance and probability</strong> es un contenido did&aacute;ctico publicado en <a href=""http://www.proyectoagrega.es/default/Inicio"" target=""_blank"">Agrega</a>, un repositorio de<a href=""http://www.proyectoagrega.es/blog/2009/12/quieres-saber-como-son-los-contenidos-digitales-educativos/"" target=""_blank""> contenidos educativos digitales</a>. Agrega es un proyecto promovido por Red.es, el Ministerio de Educaci&oacute;n y las CC.AA.<br />\n<br />\nPara obtener m&aacute;s <strong>recursos educativos</strong> y <strong>materiales did&aacute;cticos</strong> consulta la base de recursos de la comunidad <a href=""../../../../"" target=""_blank"">Didactalia: materiales did&aacute;cticos</a>.</p>\n","https://didactalia.net/comunidad/materialeducativo/recurso/chance-and-probability/bb929443-a6d0-4c3e-9142-c09b106b65f3","http://agrega2.red.es/visualizar/en/es_2008050563_0231100/false","vocabulary;comprensión lectora;problems;certain;impossible;probable;probability;chance;mathematical representation;probabilities;",2017,9,12,12,1,8,"Tuesday","2017-09-12T12:01:08Z",0.03436123348017621,0.20714285714285713,22.642,"f22e757b-8116-4496-bec4-ae93a4792c28","resourceVisited","probability",0.09803921568627451
"cd330929-4725-441b-8091-5e4581722bd5","8f186466-3edb-6cb2-e1a6-8eb6e4b09fa2","bb929443-a6d0-4c3e-9142-c09b106b65f3","Chance and probability","<p>&quot;Learning unit on chance, probability, their mathematical representation and their impact on daily life &quot; Fuente: <a href=""http://contenidos.proyectoagrega.es/buscador/BuscarAvanzadoCU/MostrarResultadosImagenesPrepararRetornoDetalleImagenes.do?idioma=en&amp;buscContenido=&amp;pagina=1&amp;formato=&amp;recurso=&amp;procesoCognitivo=&amp;contexto=&amp;edad=&amp;autor=&amp;diaPublic=&amp;mesPublic=&amp;anyoPublic=&amp;c_s_secuencia=&amp;valoracion=&amp;enlaceTaxSelec=&amp;identificadorODE=es_2008050563_0231100&amp;tipoVisualiz=CON_IMAGENES&amp;nodoDestino=&amp;enlaceComuSelec=&amp;tipoBusqueda=03&amp;enlaceTodoAgrega=&amp;tipoLayoutBuscador=NEUTRO&amp;idTesauro=&amp;nomTesauros=&amp;idTesauroSug=&amp;nivelAgreg=3&amp;destinatarios=&amp;keyword=&amp;numeroResultados=10000"" target=""_blank"">Proyecto Agrega</a><br />\n<br />\n<strong>Chance and probability</strong> es un contenido did&aacute;ctico publicado en <a href=""http://www.proyectoagrega.es/default/Inicio"" target=""_blank"">Agrega</a>, un repositorio de<a href=""http://www.proyectoagrega.es/blog/2009/12/quieres-saber-como-son-los-contenidos-digitales-educativos/"" target=""_blank""> contenidos educativos digitales</a>. Agrega es un proyecto promovido por Red.es, el Ministerio de Educaci&oacute;n y las CC.AA.<br />\n<br />\nPara obtener m&aacute;s <strong>recursos educativos</strong> y <strong>materiales did&aacute;cticos</strong> consulta la base de recursos de la comunidad <a href=""../../../../"" target=""_blank"">Didactalia: materiales did&aacute;cticos</a>.</p>\n","https://didactalia.net/comunidad/materialeducativo/recurso/chance-and-probability/bb929443-a6d0-4c3e-9142-c09b106b65f3","http://agrega2.red.es/visualizar/en/es_2008050563_0231100/false","vocabulary;comprensión lectora;problems;certain;impossible;probable;probability;chance;mathematical representation;probabilities;",2017,9,12,12,1,0,"Tuesday","2017-09-12T12:01:00Z",0.03436123348017621,0.1777777777777778,22.642,"f22e757b-8116-4496-bec4-ae93a4792c28","resourceVisited","probability",0.09803921568627451
"cd330929-4725-441b-8091-5e4581722bd5","8f186466-3edb-6cb2-e1a6-8eb6e4b09fa2","bb929443-a6d0-4c3e-9142-c09b106b65f3","Chance and probability","<p>&quot;Learning unit on chance, probability, their mathematical representation and their impact on daily life &quot; Fuente: <a href=""http://contenidos.proyectoagrega.es/buscador/BuscarAvanzadoCU/MostrarResultadosImagenesPrepararRetornoDetalleImagenes.do?idioma=en&amp;buscContenido=&amp;pagina=1&amp;formato=&amp;recurso=&amp;procesoCognitivo=&amp;contexto=&amp;edad=&amp;autor=&amp;diaPublic=&amp;mesPublic=&amp;anyoPublic=&amp;c_s_secuencia=&amp;valoracion=&amp;enlaceTaxSelec=&amp;identificadorODE=es_2008050563_0231100&amp;tipoVisualiz=CON_IMAGENES&amp;nodoDestino=&amp;enlaceComuSelec=&amp;tipoBusqueda=03&amp;enlaceTodoAgrega=&amp;tipoLayoutBuscador=NEUTRO&amp;idTesauro=&amp;nomTesauros=&amp;idTesauroSug=&amp;nivelAgreg=3&amp;destinatarios=&amp;keyword=&amp;numeroResultados=10000"" target=""_blank"">Proyecto Agrega</a><br />\n<br />\n<strong>Chance and probability</strong> es un contenido did&aacute;ctico publicado en <a href=""http://www.proyectoagrega.es/default/Inicio"" target=""_blank"">Agrega</a>, un repositorio de<a href=""http://www.proyectoagrega.es/blog/2009/12/quieres-saber-como-son-los-contenidos-digitales-educativos/"" target=""_blank""> contenidos educativos digitales</a>. Agrega es un proyecto promovido por Red.es, el Ministerio de Educaci&oacute;n y las CC.AA.<br />\n<br />\nPara obtener m&aacute;s <strong>recursos educativos</strong> y <strong>materiales did&aacute;cticos</strong> consulta la base de recursos de la comunidad <a href=""../../../../"" target=""_blank"">Didactalia: materiales did&aacute;cticos</a>.</p>\n","https://didactalia.net/comunidad/materialeducativo/recurso/chance-and-probability/bb929443-a6d0-4c3e-9142-c09b106b65f3","http://agrega2.red.es/visualizar/en/es_2008050563_0231100/false","vocabulary;comprensión lectora;problems;certain;impossible;probable;probability;chance;mathematical representation;probabilities;",2017,9,12,11,43,13,"Tuesday","2017-09-12T11:43:13Z",0.03436123348017621,0.14615384615384613,22.642,"f22e757b-8116-4496-bec4-ae93a4792c28","resourceVisited","probability",0.09803921568627451
"cd330929-4725-441b-8091-5e4581722bd5","8f186466-3edb-6cb2-e1a6-8eb6e4b09fa2","bb929443-a6d0-4c3e-9142-c09b106b65f3","Chance and probability","<p>&quot;Learning unit on chance, probability, their mathematical representation and their impact on daily life &quot; Fuente: <a href=""http://contenidos.proyectoagrega.es/buscador/BuscarAvanzadoCU/MostrarResultadosImagenesPrepararRetornoDetalleImagenes.do?idioma=en&amp;buscContenido=&amp;pagina=1&amp;formato=&amp;recurso=&amp;procesoCognitivo=&amp;contexto=&amp;edad=&amp;autor=&amp;diaPublic=&amp;mesPublic=&amp;anyoPublic=&amp;c_s_secuencia=&amp;valoracion=&amp;enlaceTaxSelec=&amp;identificadorODE=es_2008050563_0231100&amp;tipoVisualiz=CON_IMAGENES&amp;nodoDestino=&amp;enlaceComuSelec=&amp;tipoBusqueda=03&amp;enlaceTodoAgrega=&amp;tipoLayoutBuscador=NEUTRO&amp;idTesauro=&amp;nomTesauros=&amp;idTesauroSug=&amp;nivelAgreg=3&amp;destinatarios=&amp;keyword=&amp;numeroResultados=10000"" target=""_blank"">Proyecto Agrega</a><br />\n<br />\n<strong>Chance and probability</strong> es un contenido did&aacute;ctico publicado en <a href=""http://www.proyectoagrega.es/default/Inicio"" target=""_blank"">Agrega</a>, un repositorio de<a href=""http://www.proyectoagrega.es/blog/2009/12/quieres-saber-como-son-los-contenidos-digitales-educativos/"" target=""_blank""> contenidos educativos digitales</a>. Agrega es un proyecto promovido por Red.es, el Ministerio de Educaci&oacute;n y las CC.AA.<br />\n<br />\nPara obtener m&aacute;s <strong>recursos educativos</strong> y <strong>materiales did&aacute;cticos</strong> consulta la base de recursos de la comunidad <a href=""../../../../"" target=""_blank"">Didactalia: materiales did&aacute;cticos</a>.</p>\n","https://didactalia.net/comunidad/materialeducativo/recurso/chance-and-probability/bb929443-a6d0-4c3e-9142-c09b106b65f3","http://agrega2.red.es/visualizar/en/es_2008050563_0231100/false","vocabulary;comprensión lectora;problems;certain;impossible;probable;probability;chance;mathematical representation;probabilities;",2017,9,12,8,44,6,"Tuesday","2017-09-12T08:44:06Z",0.03436123348017621,0.11200000000000002,22.642,"f22e757b-8116-4496-bec4-ae93a4792c28","resourceVisited","probability",0.09803921568627451
"cd330929-4725-441b-8091-5e4581722bd5","8f186466-3edb-6cb2-e1a6-8eb6e4b09fa2","591deb55-a70d-4cae-99c5-09cfcea24684","Largest English Towns & Cities Through History","<p>Name the top 10 largest towns and cities in England over the last 6 centuries.</p><br/><p>It is an educational content by <a href=""http://www.jetpunk.com"" target=""_blank"">JetPunk</a>, site that contains a wide variety of quizzes.</p>","https://didactalia.net/comunidad/materialeducativo/recurso/largest-english-towns-cities-through-history/591deb55-a70d-4cae-99c5-09cfcea24684","http://www.jetpunk.com/user-quizzes/29596/largets-english-cities-through-history","london;norwich;bristol;newcastle;coventry;exeter;salisbury;ipswich;king's lynn;canterbury;birmingham;liverpool;manchester;sheffield;leeds;hull;middlesbrough;great yarmouth;oxford;cambridge;bradford;largest english towns;largest english cities;",2017,9,11,18,31,35,"Monday","2017-09-11T18:31:35Z",0.03436123348017621,0.04166666666666665,13.384,"f22e757b-8116-4496-bec4-ae93a4792c28","resourceVisited","",0.03436123348017621
"cd330929-4725-441b-8091-5e4581722bd5","8f186466-3edb-6cb2-e1a6-8eb6e4b09fa2","d0c0e6f3-4f10-475c-9428-849bb86a8edc","Kings and Queens of England and the United Kingdom","<p>Within the time limit and using the clues provided, name all the Monarchs from the 880s to the present.</p><br/><p>It is an educational content by <a href=""http://www.jetpunk.com"" target=""_blank"">JetPunk</a>, site that contains a wide variety of quizzes.</p>","https://didactalia.net/comunidad/materialeducativo/recurso/kings-and-queens-of-england-and-the-united-kingdom/d0c0e6f3-4f10-475c-9428-849bb86a8edc","http://www.jetpunk.com/user-quizzes/96875/kings-and-queens-of-england-and-the-united-kingdom","united kingdom;list of english monarchs;list of british monarchs;wessex;anglo-saxons;house of knýtlinga;normandy;blois;house of plantagenet;house of york;house of lancaster;tudor dynasty;house of stuart;house of hanover;saxe-coburg and gotha;house of windsor;æthelstan;edmund i;æthelred the unready;sweyn forkbeard;cnut the great;harthacnut;edgar the ætheling;william the conqueror;henry i of england;henry ii of england;richard i of england;henry iii of england;henry vi of england;edward vi of england;lady jane grey;james ii of england;charles i of england;george ii of great britain;edward vii;george v;elizabeth ii;list of british consorts;",2017,9,11,17,17,44,"Monday","2017-09-11T17:17:44Z",0.03436123348017621,0.043478260869565195,15.411,"f22e757b-8116-4496-bec4-ae93a4792c28","resourceVisited","",0.03436123348017621
