"user_id","cookie_user","Item","title","description","resource_url","link","tags","Year","Month","Day","Hour","Minutes","Seconds","Day of Week","date","topic_coverage","view_coverage","weight","community_id","type","name","scope_topic_coverage"
"cd330929-4725-441b-8091-5e4581722bd5","3eba65fb-6e34-b284-8b13-65892c58678b","90ee19f7-f06c-4f51-96b9-082be9e40b06","Édouard Manet's A Bar at the Folies-Bergère","<br><p>Édouard Manet, A Bar at the Folies-Bergère, 1882 (Courtauld Gallery, London). Speakers Beth Harris and Steven Zucker.</p><p>It is an educational content by <a href=""http://www.khanacademy.org/"" target=""_blank"">Khan Academy</a>, site that contains a wide variety of educational videos.</p>","https://didactalia.net/comunidad/materialeducativo/recurso/edouard-manets-a-bar-at-the-folies-bergere/90ee19f7-f06c-4f51-96b9-082be9e40b06","http://www.youtube.com/watch?v=kMACjCg9r4E","édouard manet;folies-bergere;courtauld gallery;impressionism;french painting;realism (arts);social realism;regionalism (art);kitchen sink realism;realism (art movement);modern art;artists from paris;french realist painters;paintings by édouard manet;a bar at the folies-bergère;oil painting;salon (paris);folies bergère;emmanuel chabrier;perspective (visual);paintings set in cabarets;",2017,9,22,14,40,34,"Friday","2017-09-22T14:40:34Z",0.051982378854625554,0.04317460317460316,12.026,"f22e757b-8116-4496-bec4-ae93a4792c28","resourceVisited","impressionism",0
"cd330929-4725-441b-8091-5e4581722bd5","3eba65fb-6e34-b284-8b13-65892c58678b","14838af3-998f-437d-bac5-887cb0736585","Name the Artists","<p>Name the artist based on the paintings he or she painted.</p><br/><p>It is an educational content by <a href=""http://www.jetpunk.com"" target=""_blank"">JetPunk</a>, site that contains a wide variety of quizzes.</p>","https://didactalia.net/comunidad/materialeducativo/recurso/name-the-artists/14838af3-998f-437d-bac5-887cb0736585","http://www.jetpunk.com/user-quizzes/45541/name-the-artists","pablo picasso;edouard manet;frida kahlo;edgar degas;paul gauguin;jackson pollock;auguste rodin;georges seurat;johannes vermeer;mark rothko;henri de toulouse-lautrec;henri matisse;rembrandt;joan mitchell;georges braque;the old guitarist;luncheon on the grass;the suicide of dorothy hale;two tahitian women;autumn rhythm;no. 5;the thinker;a sunday afternoon on the island of la grande jatte;the milkmaid;femmes de maison;red room;the storm on the sea of galilee;la vie en rose;violin and candlestick;",2017,9,22,9,15,25,"Friday","2017-09-22T09:15:25Z",0.051982378854625554,0.018173345759552647,13.526,"f22e757b-8116-4496-bec4-ae93a4792c28","resourceVisited","pablo picasso",0
"cd330929-4725-441b-8091-5e4581722bd5","3eba65fb-6e34-b284-8b13-65892c58678b","c169a46b-f1dc-475d-b16a-0fbe4a2f37c9","Probability","Probability is such an innate part of your life that you rarely think about it. However, every time you use a word like “might,” “may,” “undoubtedly,” “without fail,” or “maybe,” you are voicing a probability that an event will occur.Scientists and mathematicians like to express probability more accurately. For example, if you toss a penny in the air, the probability (P) that it will land heads can be expressed:P = # of times it lands heads / total number of coin tosses.The number will be 5/10, which reduces to ½. This means that you have a 1 out of 2 chance that the penny will land heads.<br/><br/>It is an educational content by <a href='http://www.education.com/' target='_blank'>education.com</a>.<br />By clicking on the title of this resource, you will be redirected to the content. If you want to download the project, you just have to join the website, which now is for FREE.","https://didactalia.net/comunidad/materialeducativo/recurso/probability/c169a46b-f1dc-475d-b16a-0fbe4a2f37c9","http://www.education.com/science-fair/article/probability4/","probability;coin flips;event;trial;gaussian curve;pennies;chance;fraction;number;possible;outcome;",2017,9,22,9,13,48,"Friday","2017-09-22T09:13:48Z",0.051982378854625554,0.0734744707347447,14.033,"f22e757b-8116-4496-bec4-ae93a4792c28","resourceVisited","probability",0.13071895424836602
"cd330929-4725-441b-8091-5e4581722bd5","8f186466-3edb-6cb2-e1a6-8eb6e4b09fa2","32fddcc8-9ab5-4bdc-b339-922a41b93a20","Mean, Median, Mode and Rang? At grade","Find the mean, median, mode and range of a data set.<br/><p>It is an educational content of <a href='http://www.ck12.org/' target='_blank'>CK-12 Foundation</a> (to access some of the CK-12 contents you must be logged in).</p>","https://didactalia.net/comunidad/materialeducativo/recurso/mean-median-mode-and-rang-at-grade/32fddcc8-9ab5-4bdc-b339-922a41b93a20","http://www.ck12.org/statistics/Measures-of-Central-Tendency-and-Dispersion/lesson/Mean-Median-Mode-and-Range/","mean;median;mode;range;statistics;arithmetic mean;descriptive statistics;inferential statistics;measure of central tendency;multimodal;outlier;population mean;resistant;sample mean;media;",2017,9,22,6,33,46,"Friday","2017-09-22T06:33:46Z",0.051982378854625554,0.03425925925925925,17.437,"f22e757b-8116-4496-bec4-ae93a4792c28","resourceVisited","probability",0.13071895424836602
"cd330929-4725-441b-8091-5e4581722bd5","8f186466-3edb-6cb2-e1a6-8eb6e4b09fa2","228366c4-1ec6-46e3-9be5-f2e739891c13","CK-12 Basic Probability and Statistics Concept? Basic","An introduction to theoretical probability and data organization, students will learn about events, conditions, random variables, and graphs and tables that allow them to manage data.<br/><p>It is an educational content of <a href='http://www.ck12.org/' target='_blank'>CK-12 Foundation</a> (to access some of the CK-12 contents you must be logged in).</p>","https://didactalia.net/comunidad/materialeducativo/recurso/ck-12-basic-probability-and-statistics-concept/228366c4-1ec6-46e3-9be5-f2e739891c13","http://www.ck12.org/book/CK-12-Basic-Probability-and-Statistics-Concepts/","ck-12 basic probability;statistics concepts;probability;combinations;conditional probability;conditions;data;dependent events;events;finite sample space;funda;",2017,9,22,6,33,33,"Friday","2017-09-22T06:33:33Z",0.051982378854625554,0.08706786171574903,17.694,"f22e757b-8116-4496-bec4-ae93a4792c28","resourceVisited","probability",0.13071895424836602
"cd330929-4725-441b-8091-5e4581722bd5","8f186466-3edb-6cb2-e1a6-8eb6e4b09fa2","a0419e96-0d8e-4654-8083-54d9efc41f3f","Solve Statistics-Based Problems Involving Percent? At grade","Solve statistics-based problems involving percents greater than 100 and less than one<br/><p>It is an educational content of <a href='http://www.ck12.org/' target='_blank'>CK-12 Foundation</a> (to access some of the CK-12 contents you must be logged in).</p>","https://didactalia.net/comunidad/materialeducativo/recurso/solve-statistics-based-problems-involving-percent/a0419e96-0d8e-4654-8083-54d9efc41f3f","http://www.ck12.org/arithmetic/Small-and-Large-Percents/lesson/Solve-Statistics-Based-Problems-Involving-Percents/","solve statistics-based problems involving percents;arithmetic;average;percent of change;statistics;",2017,9,22,6,33,28,"Friday","2017-09-22T06:33:28Z",0.051982378854625554,0.08285714285714285,0,"f22e757b-8116-4496-bec4-ae93a4792c28","resourceVisited","probability",0.13071895424836602
"cd330929-4725-441b-8091-5e4581722bd5","8f186466-3edb-6cb2-e1a6-8eb6e4b09fa2","3d97beaa-9106-41dc-975e-040e91d41179","A Blast With Bubbles. Art Lesson Plan (Denver Art Museum)","<p><img alt=""A Blast With Bubbles. Art Lesson Plan (Denver Art Museum)"" src=""https://contentmapas.didactalia.net/imagenes/Usuarios/ImagenesCKEditor/5d1dada8-e23b-499e-aa70-66ad03aedbc4/2384b85c-9bac-4456-80f7-20d25b608bf8.jpg"" style=""float:left; margin-left:15px; margin-right:15px"" title=""A Blast With Bubbles. Art Lesson Plan (Denver Art Museum)"" />This lesson uses bubbles to help children look more closely at the painting <em>Poppies</em> and link it to similar objects in the real-world. Bubbles are a fun way to help children do some serious learning!</p><h4><strong>Age Group: </strong>Early childhood (ages 3-5)</h4><h4><strong>Length of Lesson:</strong> One 30-minute lesson</h4><p> </p><p> </p><p><br /> </p><p>Image: <em>Poppies  </em>Andrew Dasburg, United States 1931 (Denver Art Museum)</p><h4><strong>Standards:</strong></h4><p style=""margin-left:40px""><strong>21st Century Learning Skills Addressed:</strong></p><ul>\t<li>Critical Thinking and Reasoning</li>\t<li>Collaboration</li>\t<li>Self-Direction</li></ul><p style=""margin-left:40px""><strong>2009 Colorado Academic Standards Primary Area Addressed:</strong><br />Visual Arts</p><ul>\t<li>Observe and Learn to Comprehend</li>\t<li>Relate and Connect to Transfer</li></ul><p><strong>Additional 2009 Colorado Academic Standards Addressed:</strong></p><ul style=""margin-left:40px"">\t<li>Language Arts</li>\t<li>Oral Expression and Listening</li></ul><p>See more at: <a href=""http://creativity.denverartmuseum.org/?lesson-plan=a-blast-with-bubbles#sthash.9Q6gLvS5.dpuf"" target=""_blank"">creativity.denverartmuseum.org</a></p><p> </p>","https://didactalia.net/comunidad/materialeducativo/recurso/a-blast-with-bubbles-art-lesson-plan-denver-art/3d97beaa-9106-41dc-975e-040e91d41179","http://creativity.denverartmuseum.org/?lesson-plan=a-blast-with-bubbles","art lesson plan;denver art museum;poppies;cubism;synchromism;andrew dasburg;soap bubble;flowers;blast with bubbles;",2017,9,22,6,32,7,"Friday","2017-09-22T06:32:07Z",0.051982378854625554,0.03703703703703704,20.335,"f22e757b-8116-4496-bec4-ae93a4792c28","resourceVisited","cubism",0.17307692307692307
"cd330929-4725-441b-8091-5e4581722bd5","3eba65fb-6e34-b284-8b13-65892c58678b","c169a46b-f1dc-475d-b16a-0fbe4a2f37c9","Probability","Probability is such an innate part of your life that you rarely think about it. However, every time you use a word like “might,” “may,” “undoubtedly,” “without fail,” or “maybe,” you are voicing a probability that an event will occur.Scientists and mathematicians like to express probability more accurately. For example, if you toss a penny in the air, the probability (P) that it will land heads can be expressed:P = # of times it lands heads / total number of coin tosses.The number will be 5/10, which reduces to ½. This means that you have a 1 out of 2 chance that the penny will land heads.<br/><br/>It is an educational content by <a href='http://www.education.com/' target='_blank'>education.com</a>.<br />By clicking on the title of this resource, you will be redirected to the content. If you want to download the project, you just have to join the website, which now is for FREE.","https://didactalia.net/comunidad/materialeducativo/recurso/probability/c169a46b-f1dc-475d-b16a-0fbe4a2f37c9","http://www.education.com/science-fair/article/probability4/","probability;coin flips;event;trial;gaussian curve;pennies;chance;fraction;number;possible;outcome;",2017,9,21,16,7,17,"Thursday","2017-09-21T16:07:17Z",0.051982378854625554,0.06283422459893045,14.033,"f22e757b-8116-4496-bec4-ae93a4792c28","resourceVisited","probability",0.13071895424836602
"cd330929-4725-441b-8091-5e4581722bd5","3eba65fb-6e34-b284-8b13-65892c58678b","16ac6dba-52f2-4551-a0e7-157baafdc0d3","Geometric Distribution? Basic","Covers geometric distributions.<br/><p>It is an educational content of <a href='http://www.ck12.org/' target='_blank'>CK-12 Foundation</a> (to access some of the CK-12 contents you must be logged in).</p>","https://didactalia.net/comunidad/materialeducativo/recurso/geometric-distribution-basic/16ac6dba-52f2-4551-a0e7-157baafdc0d3","http://www.ck12.org/statistics/Geometric-Distributions/lesson/Geometric-Distributions/","geometric distributions;statistics;geometric distribution;binomial distribution;",2017,9,21,16,3,55,"Thursday","2017-09-21T16:03:55Z",0.051982378854625554,0.08955223880597014,18.439,"f22e757b-8116-4496-bec4-ae93a4792c28","resourceVisited","probability",0.13071895424836602
"cd330929-4725-441b-8091-5e4581722bd5","3eba65fb-6e34-b284-8b13-65892c58678b","836c6dcf-7607-44e1-ab02-d7020a66fbc2","Normal Distribution? Advanced","This Concept introduces students to the standard normal probability distribution.<br/><p>It is an educational content of <a href='http://www.ck12.org/' target='_blank'>CK-12 Foundation</a> (to access some of the CK-12 contents you must be logged in).</p>","https://didactalia.net/comunidad/materialeducativo/recurso/normal-distribution-advanced/836c6dcf-7607-44e1-ab02-d7020a66fbc2","http://www.ck12.org/statistics/Normal-Distribution-Properties/lesson/Normal-Distributions-Advanced/","normal distributions;probability;continuous variables;discrete values;distribution;empirical rule;normal distribution curve;normal probability plot;normal quartile plot;standard normal distribution;z-score;statistics;",2017,9,21,16,3,54,"Thursday","2017-09-21T16:03:54Z",0.051982378854625554,0.08585858585858584,15.669,"f22e757b-8116-4496-bec4-ae93a4792c28","resourceVisited","probability",0.13071895424836602
"cd330929-4725-441b-8091-5e4581722bd5","3eba65fb-6e34-b284-8b13-65892c58678b","cbdd49ae-c429-48a2-93a0-c3ffce6029f3","Normal Distribution? Basic","Determine if a data set approximates a normal distribution.<br/><p>It is an educational content of <a href='http://www.ck12.org/' target='_blank'>CK-12 Foundation</a> (to access some of the CK-12 contents you must be logged in).</p>","https://didactalia.net/comunidad/materialeducativo/recurso/normal-distribution-basic/cbdd49ae-c429-48a2-93a0-c3ffce6029f3","http://www.ck12.org/statistics/Normal-Distribution-Properties/lesson/Normal-Distributions/","normal distributions;statistics;continuous variable;discrete values;distribution;normal distribution curve;continuous variables;empirical rule;normal probability plot;normal quartile plot;standard normal distribution;z-score;continuous varia;",2017,9,21,16,3,48,"Thursday","2017-09-21T16:03:48Z",0.051982378854625554,0.03668639053254438,18.727,"f22e757b-8116-4496-bec4-ae93a4792c28","resourceVisited","probability",0.13071895424836602
"cd330929-4725-441b-8091-5e4581722bd5","3eba65fb-6e34-b284-8b13-65892c58678b","4ac0ac42-799e-4c38-91d8-02904ee29b92","Art Movements","<p>Try to guess the art movements by the artists who best represent it.</p><br/><p>It is an educational content by <a href=""http://www.jetpunk.com"" target=""_blank"">JetPunk</a>, site that contains a wide variety of quizzes.</p>","https://didactalia.net/comunidad/materialeducativo/recurso/art-movements/4ac0ac42-799e-4c38-91d8-02904ee29b92","http://www.jetpunk.com/user-quizzes/28491/art-movements","art movements;artist by movement;claude monet;impressionism;michelangelo buonarroti;renaissance;salvador dali;surrealism;pablo picasso;cubism;giacomo balla;futurism;edvard munch;expressionism;andy warhol;pop art;caspar david friedrich;romanticism;gustave courbet;realism;cimabue;gothic;alphonse mucha;art nouveau;henri matisse;fauvism;kurt schwitters;dada;alexander rodchenko;constructivism;peter paul rubens;baroque;jean auguste dominique ingres;neoclassicism;kazimir malevich;suprematism;piet mondrian;de stijl;gustave moreau;symbolism;el greco;mannerism;john william waterhouse;pre-raphaelite brotherhood;michelangelo pistoletto;arte povera;lászló moholy-nagy;bauhaus;",2017,9,21,16,2,47,"Thursday","2017-09-21T16:02:47Z",0.051982378854625554,0.027994791666666668,14.486,"f22e757b-8116-4496-bec4-ae93a4792c28","resourceVisited","impressionism",0
"cd330929-4725-441b-8091-5e4581722bd5","3eba65fb-6e34-b284-8b13-65892c58678b","e903ad5c-d711-41eb-a5d7-f5cb8e104578","Art -isms","<p>Guess the art related -isms based on the clues.</p><br/><p>It is an educational content by <a href=""http://www.jetpunk.com"" target=""_blank"">JetPunk</a>, site that contains a wide variety of quizzes.</p>","https://didactalia.net/comunidad/materialeducativo/recurso/art--isms/e903ad5c-d711-41eb-a5d7-f5cb8e104578","http://www.jetpunk.com/user-quizzes/22869/art-isms","pointillism;abstract expressionism;realism;orphism;constructivism;fauvism;expressionism;stuckism;vorticism;cubism;minimalism;post-modernism;mannerism;futurism;surrealism;romanticism;neo-classicism;primitivism;impressionism;",2017,9,21,15,59,29,"Thursday","2017-09-21T15:59:29Z",0.051982378854625554,0.031746031746031744,15.978,"f22e757b-8116-4496-bec4-ae93a4792c28","resourceVisited","impressionism",0
"cd330929-4725-441b-8091-5e4581722bd5","8f186466-3edb-6cb2-e1a6-8eb6e4b09fa2","3d97beaa-9106-41dc-975e-040e91d41179","A Blast With Bubbles. Art Lesson Plan (Denver Art Museum)","<p><img alt=""A Blast With Bubbles. Art Lesson Plan (Denver Art Museum)"" src=""https://contentmapas.didactalia.net/imagenes/Usuarios/ImagenesCKEditor/5d1dada8-e23b-499e-aa70-66ad03aedbc4/2384b85c-9bac-4456-80f7-20d25b608bf8.jpg"" style=""float:left; margin-left:15px; margin-right:15px"" title=""A Blast With Bubbles. Art Lesson Plan (Denver Art Museum)"" />This lesson uses bubbles to help children look more closely at the painting <em>Poppies</em> and link it to similar objects in the real-world. Bubbles are a fun way to help children do some serious learning!</p><h4><strong>Age Group: </strong>Early childhood (ages 3-5)</h4><h4><strong>Length of Lesson:</strong> One 30-minute lesson</h4><p> </p><p> </p><p><br /> </p><p>Image: <em>Poppies  </em>Andrew Dasburg, United States 1931 (Denver Art Museum)</p><h4><strong>Standards:</strong></h4><p style=""margin-left:40px""><strong>21st Century Learning Skills Addressed:</strong></p><ul>\t<li>Critical Thinking and Reasoning</li>\t<li>Collaboration</li>\t<li>Self-Direction</li></ul><p style=""margin-left:40px""><strong>2009 Colorado Academic Standards Primary Area Addressed:</strong><br />Visual Arts</p><ul>\t<li>Observe and Learn to Comprehend</li>\t<li>Relate and Connect to Transfer</li></ul><p><strong>Additional 2009 Colorado Academic Standards Addressed:</strong></p><ul style=""margin-left:40px"">\t<li>Language Arts</li>\t<li>Oral Expression and Listening</li></ul><p>See more at: <a href=""http://creativity.denverartmuseum.org/?lesson-plan=a-blast-with-bubbles#sthash.9Q6gLvS5.dpuf"" target=""_blank"">creativity.denverartmuseum.org</a></p><p> </p>","https://didactalia.net/comunidad/materialeducativo/recurso/a-blast-with-bubbles-art-lesson-plan-denver-art/3d97beaa-9106-41dc-975e-040e91d41179","http://creativity.denverartmuseum.org/?lesson-plan=a-blast-with-bubbles","art lesson plan;denver art museum;poppies;cubism;synchromism;andrew dasburg;soap bubble;flowers;blast with bubbles;",2017,9,21,14,19,23,"Thursday","2017-09-21T14:19:23Z",0.051982378854625554,0.021505376344086016,20.335,"f22e757b-8116-4496-bec4-ae93a4792c28","resourceVisited","cubism",0.17307692307692307
"cd330929-4725-441b-8091-5e4581722bd5","8f186466-3edb-6cb2-e1a6-8eb6e4b09fa2","f0d225d8-e0d6-4bf2-89f8-b81285c0197b","Vincent van Gogh's 'Flower Beds in Holland'. Lesson Plan (EconEdLink)","<p><img alt=""Vincent van Gogh's 'Flower Beds in Holland'. Lesson Plan (EconEdLink)"" src=""http://contentmapas.didactalia.net/imagenes/usuarios/ImagenesCKEditor/5d1dada8-e23b-499e-aa70-66ad03aedbc4/d3867c6a-0888-465c-a087-27e1140b7097.jpg"" style=""float:left; height:129px; margin-left:30px; margin-right:30px; width:400px"" title=""Vincent van Gogh's 'Flower Beds in Holland'. Lesson Plan (EconEdLink)"" />Students study a painting by van Gogh called, &quot;Flower Beds in Holland.&quot; The students recognize that this farmer made a choice to grow flowers instead of another crop. Students are introduced to the concepts of choice and opportunity cost.</p>\n\n<p>Students Will:</p>\n\n<ul>\n\t<li>Recognize that farmers can&rsquo;t grow everything they might want to grow; they must choose which crops to grow.</li>\n\t<li>Discover that the crop that is not grown is the opportunity cost.</li>\n</ul>\n","https://didactalia.net/comunidad/materialeducativo/recurso/vincent-van-goghs-flower-beds-in-holland-lesson/f0d225d8-e0d6-4bf2-89f8-b81285c0197b","http://www.econedlink.org/teacher-lesson/267/","plan;flower beds in holland;lesson plan;vincent van gogh;flower;holland;econedlink;flower garden;flower beds;bulb fields;",2017,9,21,13,48,29,"Thursday","2017-09-21T13:48:29Z",0.051982378854625554,0.039344262295081964,0,"f22e757b-8116-4496-bec4-ae93a4792c28","resourceVisited","vincent van gogh",0.12643678160919541
"cd330929-4725-441b-8091-5e4581722bd5","8f186466-3edb-6cb2-e1a6-8eb6e4b09fa2","f0d225d8-e0d6-4bf2-89f8-b81285c0197b","Vincent van Gogh's 'Flower Beds in Holland'. Lesson Plan (EconEdLink)","<p><img alt=""Vincent van Gogh's 'Flower Beds in Holland'. Lesson Plan (EconEdLink)"" src=""http://contentmapas.didactalia.net/imagenes/usuarios/ImagenesCKEditor/5d1dada8-e23b-499e-aa70-66ad03aedbc4/d3867c6a-0888-465c-a087-27e1140b7097.jpg"" style=""float:left; height:129px; margin-left:30px; margin-right:30px; width:400px"" title=""Vincent van Gogh's 'Flower Beds in Holland'. Lesson Plan (EconEdLink)"" />Students study a painting by van Gogh called, &quot;Flower Beds in Holland.&quot; The students recognize that this farmer made a choice to grow flowers instead of another crop. Students are introduced to the concepts of choice and opportunity cost.</p>\n\n<p>Students Will:</p>\n\n<ul>\n\t<li>Recognize that farmers can&rsquo;t grow everything they might want to grow; they must choose which crops to grow.</li>\n\t<li>Discover that the crop that is not grown is the opportunity cost.</li>\n</ul>\n","https://didactalia.net/comunidad/materialeducativo/recurso/vincent-van-goghs-flower-beds-in-holland-lesson/f0d225d8-e0d6-4bf2-89f8-b81285c0197b","http://www.econedlink.org/teacher-lesson/267/","plan;flower beds in holland;lesson plan;vincent van gogh;flower;holland;econedlink;flower garden;flower beds;bulb fields;",2017,9,21,12,56,20,"Thursday","2017-09-21T12:56:20Z",0.051982378854625554,0.02333333333333333,0,"f22e757b-8116-4496-bec4-ae93a4792c28","resourceVisited","vincent van gogh",0.12643678160919541
"cd330929-4725-441b-8091-5e4581722bd5","8f186466-3edb-6cb2-e1a6-8eb6e4b09fa2","0b61bc9c-8e2f-441a-aab5-52459df2dd73","The Diseases they Had","<p>We give you two people. Name the medical disorder they suffer(ed) from. Some of the diagnoses for historical figures are speculative. Includes psychiatric disorders</p><br/><p>It is an educational content by <a href=""http://www.jetpunk.com"" target=""_blank"">JetPunk</a>, site that contains a wide variety of quizzes.</p>","https://didactalia.net/comunidad/materialeducativo/recurso/the-diseases-they-had/0b61bc9c-8e2f-441a-aab5-52459df2dd73","http://www.jetpunk.com/quizzes/the-diseases-they-had","diseases they had;hiv;cancer;depression (mood);poliomyelitis;diabetes;gout;anorexia;parkinson's disease;amyotrophic lateral sclerosis;lupus;alzheimer's disease;bipolar disorder;epilepsy;herpes simplex;dyslexia;malaria;hemophilia;syphilis;smallpox;magic johnson;arthur ashe;lance armstrong;steve jobs;abraham lincoln;owen wilson;franklin d. roosevelt;donald sutherland;wilford brimley;paula dean;king henry viii;jim belushi;portia de rossi;calista flockheart;michael j. fox;muhammad ali;lou gehrig;stephen hawking;seal;nick cannon;ronald reagan;charlton heston;vincent van gogh;russell brand;julius caesar;lil wayne;michael vick;kim kardashian;whoopi goldberg;albert einstein;oliver cromwell;david livingstone;queen victoria (carrier);tsarevich alexei;cesare borgia;paul gauguin;george washington;queen elizabeth i;",2017,9,21,12,41,30,"Thursday","2017-09-21T12:41:30Z",0.051982378854625554,0.017825832846288702,15.366,"f22e757b-8116-4496-bec4-ae93a4792c28","resourceVisited","vincent van gogh",0.12643678160919541
