"user_id","cookie_user","Item","title","description","resource_url","link","tags","Year","Month","Day","Hour","Minutes","Seconds","Day of Week","date","topic_coverage","view_coverage","weight","community_id","type","name","scope_topic_coverage"
"cd330929-4725-441b-8091-5e4581722bd5","8f186466-3edb-6cb2-e1a6-8eb6e4b09fa2","bfdf0f9a-d638-4147-82e2-02ac96e8876f","Recognizing Permutation? At grade","Recognize permutations in situations where order is important.<br/><p>It is an educational content of <a href='http://www.ck12.org/' target='_blank'>CK-12 Foundation</a> (to access some of the CK-12 contents you must be logged in).</p>","https://didactalia.net/comunidad/materialeducativo/recurso/recognizing-permutation-at-grade/bfdf0f9a-d638-4147-82e2-02ac96e8876f","http://www.ck12.org/probability/Permutations/lesson/Recognizing-Permutations/","recognizing permutations;probability;permutation;order;",2017,9,26,18,57,3,"Tuesday","2017-09-26T18:57:03Z",0.06872246696035242,0.12155963302752294,17.946,"f22e757b-8116-4496-bec4-ae93a4792c28","resourceVisited","probability",0.17647058823529413
"cd330929-4725-441b-8091-5e4581722bd5","8f186466-3edb-6cb2-e1a6-8eb6e4b09fa2","d367b502-afe3-4d02-b4bc-ed5192490921","Probability and Permutation? Basic","Calculate the number of permutations in order to find probabilities.<br/><p>It is an educational content of <a href='http://www.ck12.org/' target='_blank'>CK-12 Foundation</a> (to access some of the CK-12 contents you must be logged in).</p>","https://didactalia.net/comunidad/materialeducativo/recurso/probability-and-permutation-basic/d367b502-afe3-4d02-b4bc-ed5192490921","http://www.ck12.org/probability/Probability-and-Permutations/lesson/Probability-and-Permutations/","probability;permutations;permutation;combination;favorable outcome;favorable outcomes;",2017,9,26,18,56,49,"Tuesday","2017-09-26T18:56:49Z",0.06872246696035242,0.09413580246913582,18.821,"f22e757b-8116-4496-bec4-ae93a4792c28","resourceVisited","probability",0.17647058823529413
"cd330929-4725-441b-8091-5e4581722bd5","8f186466-3edb-6cb2-e1a6-8eb6e4b09fa2","36f63190-5096-4d82-9a19-9c08a1601e72","Permutation Problem? Basic","Use technology to solve permutation problems.<br/><p>It is an educational content of <a href='http://www.ck12.org/' target='_blank'>CK-12 Foundation</a> (to access some of the CK-12 contents you must be logged in).</p>","https://didactalia.net/comunidad/materialeducativo/recurso/permutation-problem-basic/36f63190-5096-4d82-9a19-9c08a1601e72","http://www.ck12.org/probability/Permutation-Problems/lesson/Permutation-Problems/","permutation problems;probability;value;combination;factorial;n value;permutation;r value;permutation notation;permutations;technology;ti calcula;",2017,9,26,18,56,40,"Tuesday","2017-09-26T18:56:40Z",0.06872246696035242,0.061526479750778816,18.439,"f22e757b-8116-4496-bec4-ae93a4792c28","resourceVisited","probability",0.17647058823529413
"cd330929-4725-441b-8091-5e4581722bd5","8f186466-3edb-6cb2-e1a6-8eb6e4b09fa2","36f63190-5096-4d82-9a19-9c08a1601e72","Permutation Problem? Basic","Use technology to solve permutation problems.<br/><p>It is an educational content of <a href='http://www.ck12.org/' target='_blank'>CK-12 Foundation</a> (to access some of the CK-12 contents you must be logged in).</p>","https://didactalia.net/comunidad/materialeducativo/recurso/permutation-problem-basic/36f63190-5096-4d82-9a19-9c08a1601e72","http://www.ck12.org/probability/Permutation-Problems/lesson/Permutation-Problems/","permutation problems;probability;value;combination;factorial;n value;permutation;r value;permutation notation;permutations;technology;ti calcula;",2017,9,26,18,56,18,"Tuesday","2017-09-26T18:56:18Z",0.06872246696035242,0.05267295597484276,18.439,"f22e757b-8116-4496-bec4-ae93a4792c28","resourceVisited","probability",0.17647058823529413
"cd330929-4725-441b-8091-5e4581722bd5","8f186466-3edb-6cb2-e1a6-8eb6e4b09fa2","9827a2bd-6214-4e79-b4e1-d8530c5ed2fe","Permutation? At grade","Given a set, learn how to calculate its number of permutations.<br/><p>It is an educational content of <a href='http://www.ck12.org/' target='_blank'>CK-12 Foundation</a> (to access some of the CK-12 contents you must be logged in).</p>","https://didactalia.net/comunidad/materialeducativo/recurso/permutation-at-grade/9827a2bd-6214-4e79-b4e1-d8530c5ed2fe","http://www.ck12.org/probability/Permutations/lesson/Permutations/","permutations;probability;permutation;factorial notation;",2017,9,26,18,56,5,"Tuesday","2017-09-26T18:56:05Z",0.06872246696035242,0.10714285714285715,17.846,"f22e757b-8116-4496-bec4-ae93a4792c28","resourceVisited","probability",0.17647058823529413
"cd330929-4725-441b-8091-5e4581722bd5","8f186466-3edb-6cb2-e1a6-8eb6e4b09fa2","a11d054a-d9bf-4c1b-854e-45dadc8d5b17","Permutation Problem? At grade","Count and evaluate permutations<br/><p>It is an educational content of <a href='http://www.ck12.org/' target='_blank'>CK-12 Foundation</a> (to access some of the CK-12 contents you must be logged in).</p>","https://didactalia.net/comunidad/materialeducativo/recurso/permutation-problem-at-grade/a11d054a-d9bf-4c1b-854e-45dadc8d5b17","http://www.ck12.org/probability/Permutation-Problems/lesson/Permutation-Problems-Grade-7/","permutation problems;probability;!;combination;factorial;n value;permutation;r value;counting rule;",2017,9,26,18,55,30,"Tuesday","2017-09-26T18:55:30Z",0.06872246696035242,0.05982905982905984,15.669,"f22e757b-8116-4496-bec4-ae93a4792c28","resourceVisited","probability",0.17647058823529413
"cd330929-4725-441b-8091-5e4581722bd5","8f186466-3edb-6cb2-e1a6-8eb6e4b09fa2","b0961ca0-2921-4034-b18f-4e1bad0f8701","Renoir en la Frick. ArteCreha","<p><img alt="""" src=""https://contentmapas.didactalia.net/imagenes/Usuarios/ImagenesCKEditor/6538b53e-a0ec-406f-8456-e1b38647c4b4/8e59c614-a3ab-4317-81c2-1cbdd73279bf.jpg"" />La Colecci&oacute;n Frick es un museo de arte situado en la ciudad de Manhattan, en la antigua residencia del magnate del acero Henry Clay Frick. El a&ntilde;o pasado, se celebr&oacute; una exposici&oacute;n dedicada a nueve grandes obras de Pierre Auguste Renoir, titulada &ldquo;Renoir, Impressionism, and Full-Length Painting&rdquo;. La web de la Colecci&oacute;n Frick aporta una ficha de cada una de las nueve obras que se exhiben, y un apartado que reune seis v&iacute;deos que analizan y comentan algunas de ellas.</p>\n\n<p>Es un contenido educativo publicado en <a href=""http://www.artecreha.com/"" target=""_blank"">ArteCreha</a>, un portal dedicado a la did&aacute;ctica de la Historia del Arte.</p>\n\n<p>Para obtener m&aacute;s <strong>recursos educativos</strong> consulta el <a href=""http://didactalia.net/comunidad/materialeducativo/indice"" target=""_blank"">&iacute;ndice</a> y el <a href=""http://didactalia.net/comunidad/materialeducativo/recursos"" target=""_blank"">el buscador facetado de Didactialia</a>.</p>\n","https://didactalia.net/comunidad/materialeducativo/recurso/renoir-en-la-frick-artecreha/b0961ca0-2921-4034-b18f-4e1bad0f8701","http://www.artecreha.com/renoir-en-la-frick/","frick collection;pintura;pierre auguste renoir;manhattan;exposición;nueva york;",2017,9,26,18,21,13,"Tuesday","2017-09-26T18:21:13Z",0.06872246696035242,0.019417475728155335,18.244,"f22e757b-8116-4496-bec4-ae93a4792c28","resourceVisited","",0.06872246696035242
"cd330929-4725-441b-8091-5e4581722bd5","8f186466-3edb-6cb2-e1a6-8eb6e4b09fa2","b0961ca0-2921-4034-b18f-4e1bad0f8701","Renoir en la Frick. ArteCreha","<p><img alt="""" src=""https://contentmapas.didactalia.net/imagenes/Usuarios/ImagenesCKEditor/6538b53e-a0ec-406f-8456-e1b38647c4b4/8e59c614-a3ab-4317-81c2-1cbdd73279bf.jpg"" />La Colecci&oacute;n Frick es un museo de arte situado en la ciudad de Manhattan, en la antigua residencia del magnate del acero Henry Clay Frick. El a&ntilde;o pasado, se celebr&oacute; una exposici&oacute;n dedicada a nueve grandes obras de Pierre Auguste Renoir, titulada &ldquo;Renoir, Impressionism, and Full-Length Painting&rdquo;. La web de la Colecci&oacute;n Frick aporta una ficha de cada una de las nueve obras que se exhiben, y un apartado que reune seis v&iacute;deos que analizan y comentan algunas de ellas.</p>\n\n<p>Es un contenido educativo publicado en <a href=""http://www.artecreha.com/"" target=""_blank"">ArteCreha</a>, un portal dedicado a la did&aacute;ctica de la Historia del Arte.</p>\n\n<p>Para obtener m&aacute;s <strong>recursos educativos</strong> consulta el <a href=""http://didactalia.net/comunidad/materialeducativo/indice"" target=""_blank"">&iacute;ndice</a> y el <a href=""http://didactalia.net/comunidad/materialeducativo/recursos"" target=""_blank"">el buscador facetado de Didactialia</a>.</p>\n","https://didactalia.net/comunidad/materialeducativo/recurso/renoir-en-la-frick-artecreha/b0961ca0-2921-4034-b18f-4e1bad0f8701","http://www.artecreha.com/renoir-en-la-frick/","frick collection;pintura;pierre auguste renoir;manhattan;exposición;nueva york;",2017,9,26,13,18,17,"Tuesday","2017-09-26T13:18:17Z",0.06872246696035242,0.00980392156862745,18.244,"f22e757b-8116-4496-bec4-ae93a4792c28","resourceVisited","",0.06872246696035242
"cd330929-4725-441b-8091-5e4581722bd5","8f186466-3edb-6cb2-e1a6-8eb6e4b09fa2","f9ee3be6-e7de-4c2e-a2dd-a39ff2d28582","Monet's Poplars","<br><p>Claude Monet, Poplars, 1891, oil on canvas, 36-5/8 x 29-3/16 inches / 93 x 74.1 cm (Philadelphia Museum of Art)</p><p>It is an educational content by <a href=""http://www.khanacademy.org/"" target=""_blank"">Khan Academy</a>, site that contains a wide variety of educational videos.</p>","https://didactalia.net/comunidad/materialeducativo/recurso/monets-poplars/f9ee3be6-e7de-4c2e-a2dd-a39ff2d28582","http://www.youtube.com/watch?v=JCKshDyxjuw","claude monet;poplars;1891;philadelphia museum of art;monet;impressionism;light;fleeting;landscape painting;painting;google art project;oer;art exhibition;composition (visual arts);en plein air;french art;société anonyme des artistes peintres;sculpteurs et graveurs;impression;sunrise;19th-century french painters;20th-century french painters;artists from paris;impressionist painters;french impressionist painters;paintings by claude monet;poplar series (monet);epte;poplars (autumn);",2017,9,26,13,17,13,"Tuesday","2017-09-26T13:17:13Z",0.06872246696035242,0.061795834755889414,12.444,"f22e757b-8116-4496-bec4-ae93a4792c28","resourceVisited","impressionism",0
"cd330929-4725-441b-8091-5e4581722bd5","8f186466-3edb-6cb2-e1a6-8eb6e4b09fa2","b160f4ca-a8e3-4db5-9a73-d9d806085030","Magritte's The Treachery of Images (Ceci n’est pas une pipe)","<br><p>René Magritte, The Treachery of Images (Ceci n'est pas une pipe), 1929 (LACMA). Speakers Dr. Beth Harris, Dr. Steven Zucker.</p><p>It is an educational content by <a href=""http://www.khanacademy.org/"" target=""_blank"">Khan Academy</a>, site that contains a wide variety of educational videos.</p>","https://didactalia.net/comunidad/materialeducativo/recurso/magrittes-the-treachery-of-images-ceci-nest-pas/b160f4ca-a8e3-4db5-9a73-d9d806085030","http://www.youtube.com/watch?v=w702yvnip_w","magritte;pipe;surrealism;lacma;rené magritte;painting;impressionism;académie royale des beaux-arts;futurism;cubism;jean metzinger;belgian painters;modern painters;surrealist artists;20th-century painters;paintings by rené magritte;los angeles county museum of art;the treachery of images;ceci n'est pas une pipe;tobacco pipe;subtext;paralanguage;meta-communication;surrealist paintings;",2017,9,26,13,16,53,"Tuesday","2017-09-26T13:16:53Z",0.06872246696035242,0.030000000000000002,12.222,"f22e757b-8116-4496-bec4-ae93a4792c28","resourceVisited","impressionism",0
"cd330929-4725-441b-8091-5e4581722bd5","8f186466-3edb-6cb2-e1a6-8eb6e4b09fa2","64974ab4-ea76-4e0f-8e81-993f53063ae2","Post-Impressionism Seurat's A Sunday on La Grande Jatte - 1884","<br><p>Georges Seurat, A Sunday on La Grande Jatte - 1884, 1884-86, oil on canvas, 81-3/4 x 121-1/4 inches / 207.5 x 308.1 cm (The Art Institute of Chicago). In the Google Art projecthttp://www.googleartproject.com/collection/the-art-institute-of-chicago/artwork/a-sunday-on-la-grande-jatte-1884-georges-seurat/609033</p><p>It is an educational content by <a href=""http://www.khanacademy.org/"" target=""_blank"">Khan Academy</a>, site that contains a wide variety of educational videos.</p>","https://didactalia.net/comunidad/materialeducativo/recurso/post-impressionism-seurats-a-sunday-on-la-grande/64974ab4-ea76-4e0f-8e81-993f53063ae2","http://www.youtube.com/watch?v=wNB9Vm6MoDQ","impressionism;post-impressionism;georges seurat;seurat;grande jatte;art institute of chicago;divisionism;neo-impressionism;pointillism;google art project;oer;painting;georges-pierre seurat;art movement;drawing;roger fry;edwardian era;félix fénéon;painting techniques;artistic techniques;artists from paris;divisionist painters;post-impressionist painters;alumni of the école des beaux-arts;national gallery;paintings by georges seurat;a sunday on la grande jatte;a sunday afternoon on the island of la grande jatte;landscape painting;optics;perception;dogs in art;",2017,9,26,13,16,2,"Tuesday","2017-09-26T13:16:02Z",0.06872246696035242,0.05587121212121211,12.065,"f22e757b-8116-4496-bec4-ae93a4792c28","resourceVisited","impressionism",0
"cd330929-4725-441b-8091-5e4581722bd5","8f186466-3edb-6cb2-e1a6-8eb6e4b09fa2","88eb8b3e-d592-4a45-ad03-4264cba8fa1e","The probability function","<p>You&#39;ll learn the definition of the probability function.</p>\n\n<p>At the end of the theorical explanation, you can practice or create 5 exercises to master this subject.</p>\n\n<p><em><strong>The probability function</strong></em>&nbsp;is an educative content by &nbsp;<a href=""http://sangakoo.com/"" target=""_blank"">Sangakoo</a>, a social network that helps you learning mathematics.</p>\n","https://didactalia.net/comunidad/materialeducativo/recurso/the-probability-function/88eb8b3e-d592-4a45-ad03-4264cba8fa1e","http://www.sangakoo.com/en/unit/the-probability-function","random variables;discrete random variables;continuous random variables;variables discrete;continuous variables;probability;statistics;probability function;typical deviation;mean deviation;mathematical distribution;variables aleatorias;variables aleatorias discretas;variables aleatorias continuas;variables discretas;variables continuas;probabilidad;estadística;función de probabilidad;desviación tipica;desviación media;sangakoo;didactalia;random variable;deviation (statistics);distribución matemática;",2017,9,26,13,15,30,"Tuesday","2017-09-26T13:15:30Z",0.06872246696035242,0.057692307692307675,16.728,"f22e757b-8116-4496-bec4-ae93a4792c28","resourceVisited","probability",0.17647058823529413
"cd330929-4725-441b-8091-5e4581722bd5","8f186466-3edb-6cb2-e1a6-8eb6e4b09fa2","a11d054a-d9bf-4c1b-854e-45dadc8d5b17","Permutation Problem? At grade","Count and evaluate permutations<br/><p>It is an educational content of <a href='http://www.ck12.org/' target='_blank'>CK-12 Foundation</a> (to access some of the CK-12 contents you must be logged in).</p>","https://didactalia.net/comunidad/materialeducativo/recurso/permutation-problem-at-grade/a11d054a-d9bf-4c1b-854e-45dadc8d5b17","http://www.ck12.org/probability/Permutation-Problems/lesson/Permutation-Problems-Grade-7/","permutation problems;probability;!;combination;factorial;n value;permutation;r value;counting rule;",2017,9,26,13,14,56,"Tuesday","2017-09-26T13:14:56Z",0.06872246696035242,0.05269186712485682,15.669,"f22e757b-8116-4496-bec4-ae93a4792c28","resourceVisited","probability",0.17647058823529413
"cd330929-4725-441b-8091-5e4581722bd5","471a2afa-2550-5e85-f86e-5be45091a0ad","99704108-8b32-4e2d-a4f2-f8779870b35b","Países de la Unión Europea@es|||Mitgliedstaaten der Europäischen Union@de|||Estados da União Europeia@pt|||Estados da Unión Europea@gl|||Estats de la Unió Europea@ca|||Europar Batasuneko estatu kideak@eu|||European union countries@en|||Membri dell'Unione europea@it|||États de l'Union européenne@fr|||","<p>Se&ntilde;ala en el mapa cada uno de pa&iacute;ses por los que te preguntan.</p>\n\n<p>Ampl&iacute;a o reduce el mapa con el zoom y ajusta su tama&ntilde;o a la pantalla de tu dispositivo. Tambi&eacute;n puedes clicar sobre el mapa y arrastrarlo para centrarlo.</p>@es|||<p>Consegue encontrar os elementos geogr&aacute;ficos pedidos? Tem de assinalar no mapa onde se encontra exatamente cada um.</p><p>Amplia ou reduz o mapa com o zoom e ajusta seu tamanho para a tela do seu dispositivo. Voc&ecirc; tamb&eacute;m pode clicar no mapa e arraste para o centro.</p>@pt|||<p>Sauriez-vous localiser sur la carte chaque entit&eacute; g&eacute;ographique? Vous devez indiquer sur la carte exactement o&ugrave; se trouve chacune.</p><p>Agrandissez o r&eacute;duisez la carte avec le zoom et ajustez sa taille &agrave; l&#39;&eacute;cran de votre appareil. Vous pouvez &eacute;galement cliquer sur la carte et faites glisser vers le centre.</p>@fr|||<p>Saber&iacute;as situar os elementos xeogr&aacute;ficos polos que che preguntan? Tes que sinalar no mapa onde se encontra exactamente cada un.</p><p>Ampl&iacute;a ou reduce o mapa co zoom e axusta o seu tama&ntilde;o &aacute; pantalla do teu dispositivo. Tam&eacute;n podes clicar sobre o mapa e arrastralo para centralo.</p>@gl|||<p>Sapresti individuare gli elementi geografici richiesti? Segna sulla mappa dove si trovano i cosiddetti elementi.</p><p>Ingrandisci o riduci la mappa con lo zoom e regola le dimensioni sullo schermo del dispositivo. &Egrave; inoltre possibile fare clic sulla mappa e trascinarla al centro.</p>@it|||<p>Saps situar els elements geogr&agrave;fics que et demanen? Has d&rsquo;assenyalar al mapa on es troba cada element.</p><p>Amplia o redueix el mapa amb el zoom i ajusta la seva mida a la pantalla del teu dispositiu. Tamb&eacute; pots clicar sobre el mapa i arrossegar per centrar-lo.</p>@ca|||<p>K&ouml;nntest Du, die geographische Objekte ausfinding manche? Du musst auf die Landkarte genau zeigen, wo jeder sich befindet.</p><p>Vergr&ouml;&szlig;ern oder verkleinern Sie die Karte mit dem Zoom, und anpassen Sie ihre Gr&ouml;&szlig;e um den Bildschirm des Ger&auml;ts. Sie k&ouml;nnen auch auf die Karte klicken und die zum Zentrum ziehen.</p>@de|||<p>Aipatutako lekuak kokatuko zenituzke? Mapan zehazki seinalatu behar duzu non aurkitzen den leku bakoitza.</p><p>Ampl&iacute;a o reduce el mapa con el zoom y ajusta su tama&ntilde;o a la pantalla de tu dispositivo. Tambi&eacute;n puedes clicar sobre el mapa y arrastrarlo para centrarlo.</p>@eu|||<p>Would you know to locate on the map each country you are being asked for? Try yourself with this interactive map of Didactalia.</p><p>Zoom in or zoom out the map in order to adjust it to the size of your desktop&rsquo;s device. You also can click on it and drag to centre the image.</p>@en|||","https://mapasinteractivos.didactalia.net/comunidad/mapasflashinteractivos/recurso/paises-de-la-union-europea/99704108-8b32-4e2d-a4f2-f8779870b35b",,"alemania;austria;bélgica;bulgaria;chipre;dinamarca;eslovaquia;eslovenia;españa;estonia;finlandia;francia;grecia;holanda;hungría;irlanda;italia;letonia;lituania;luxemburgo;malta;polonia;portugal;reino unido;república checa;rumania;suecia;países europeos;países de la unión europea;unión europea;mapa de europa;mapa político de europa;estados de la unión europa;estados europeos;mapa político de la unión europea;mapa de la unión europea;",2017,9,26,13,9,36,"Tuesday","2017-09-26T13:09:36Z",0.06872246696035242,0.01041666666666667,23.845,"216c614f-0066-469a-9c94-8e0dde45bc3d","resourceVisited","",0.06872246696035242
"cd330929-4725-441b-8091-5e4581722bd5","8f186466-3edb-6cb2-e1a6-8eb6e4b09fa2","9f9071de-6b2e-4f28-a8e1-2368cf98a104","Quién era Bertrand Russell","<p>Las etiquetas de fil&oacute;sofo, matem&aacute;tico, escritor, educador y divulgador, son apropiadas pero no bastan para darnos una idea de la persona que fue Bertrand Russell. Vivi&oacute; 97 a&ntilde;os (naci&oacute; en 1872 y muri&oacute; en 1970), se cas&oacute; en cuatro ocasiones, escribi&oacute; m&aacute;s de 70 libros, estuvo dos veces encarcelado, recibi&oacute; el premio Nobel, viaj&oacute; a Alemania, Rusia, China, EE.UU... luch&oacute; por el voto de la mujer, el pacifismo y por la fundaci&oacute;n de una organizaci&oacute;n mundial que, aglutinando a todas las naciones, lograse poner fin a todas las guerras. Sus obras en el &aacute;mbito de la l&oacute;gica y los fundamentos de la matem&aacute;tica supusieron su mayor aportaci&oacute;n al campo de la filosof&iacute;a.</p>\n","https://didactalia.net/comunidad/materialeducativo/recurso/quien-era-bertrand-russell/9f9071de-6b2e-4f28-a8e1-2368cf98a104","http://www.filosofos.net/russell/russell_ini.htm","russell;bertrand russell;nobel;premio nobel;principia mathematica;pacifismo;fundamentos de la matemática;lógica;atomismo lógico;wittgenstein;moore;keynes;cambridge;",2017,9,26,13,3,20,"Tuesday","2017-09-26T13:03:20Z",0.06872246696035242,0.01133603238866397,16.057,"f22e757b-8116-4496-bec4-ae93a4792c28","resourceVisited","",0.06872246696035242
"cd330929-4725-441b-8091-5e4581722bd5","8f186466-3edb-6cb2-e1a6-8eb6e4b09fa2","88eb8b3e-d592-4a45-ad03-4264cba8fa1e","The probability function","<p>You&#39;ll learn the definition of the probability function.</p>\n\n<p>At the end of the theorical explanation, you can practice or create 5 exercises to master this subject.</p>\n\n<p><em><strong>The probability function</strong></em>&nbsp;is an educative content by &nbsp;<a href=""http://sangakoo.com/"" target=""_blank"">Sangakoo</a>, a social network that helps you learning mathematics.</p>\n","https://didactalia.net/comunidad/materialeducativo/recurso/the-probability-function/88eb8b3e-d592-4a45-ad03-4264cba8fa1e","http://www.sangakoo.com/en/unit/the-probability-function","random variables;discrete random variables;continuous random variables;variables discrete;continuous variables;probability;statistics;probability function;typical deviation;mean deviation;mathematical distribution;variables aleatorias;variables aleatorias discretas;variables aleatorias continuas;variables discretas;variables continuas;probabilidad;estadística;función de probabilidad;desviación tipica;desviación media;sangakoo;didactalia;random variable;deviation (statistics);distribución matemática;",2017,9,25,16,50,53,"Monday","2017-09-25T16:50:53Z",0.06872246696035242,0.04909983633387887,16.728,"f22e757b-8116-4496-bec4-ae93a4792c28","resourceVisited","probability",0.17647058823529413
"cd330929-4725-441b-8091-5e4581722bd5","8f186466-3edb-6cb2-e1a6-8eb6e4b09fa2","e008280a-1f17-4078-a713-40cd88a7f9c2","Toulouse-Lautrec's At the Moulin Rouge","<br><p>Henri de Toulouse-Lautrec, At the Moulin Rouge, 1893-95, oil on canvas, 48-1/2 x 55-1/2 inches / 123 x 141 cm (Art Institute of Chicago)</p><p>It is an educational content by <a href=""http://www.khanacademy.org/"" target=""_blank"">Khan Academy</a>, site that contains a wide variety of educational videos.</p>","https://didactalia.net/comunidad/materialeducativo/recurso/toulouse-lautrecs-at-the-moulin-rouge/e008280a-1f17-4078-a713-40cd88a7f9c2","http://www.youtube.com/watch?v=XLcbGHNFcpM","henri de toulouse-lautrec;toulouse-lautrec;moulin rouge;cabaret;art institute of chicago;demimonde;demi-monde;nightlife;night club;painting;google art project;oer;printmaking;drawing;illustrator;post-impressionism;fauvism;impressionism;neo-impressionism;symbolism (arts);cloisonnism;pont-aven school;synthetism;edwardian era;art nouveau;applied arts;decorative arts;gesamtkunstwerk;graphic arts;fine art;19th-century french painters;art nouveau illustrators;art nouveau painters;french illustrators;french printmakers;french poster artists;post-impressionist painters;paintings by henri de toulouse-lautrec;at the moulin rouge;édouard dujardin;works set in the moulin rouge;paintings set in cabarets;",2017,9,25,7,19,16,"Monday","2017-09-25T07:19:16Z",0.06872246696035242,0.05145929339477724,11.766,"f22e757b-8116-4496-bec4-ae93a4792c28","resourceVisited","impressionism",0
"cd330929-4725-441b-8091-5e4581722bd5","8f186466-3edb-6cb2-e1a6-8eb6e4b09fa2","e008280a-1f17-4078-a713-40cd88a7f9c2","Toulouse-Lautrec's At the Moulin Rouge","<br><p>Henri de Toulouse-Lautrec, At the Moulin Rouge, 1893-95, oil on canvas, 48-1/2 x 55-1/2 inches / 123 x 141 cm (Art Institute of Chicago)</p><p>It is an educational content by <a href=""http://www.khanacademy.org/"" target=""_blank"">Khan Academy</a>, site that contains a wide variety of educational videos.</p>","https://didactalia.net/comunidad/materialeducativo/recurso/toulouse-lautrecs-at-the-moulin-rouge/e008280a-1f17-4078-a713-40cd88a7f9c2","http://www.youtube.com/watch?v=XLcbGHNFcpM","henri de toulouse-lautrec;toulouse-lautrec;moulin rouge;cabaret;art institute of chicago;demimonde;demi-monde;nightlife;night club;painting;google art project;oer;printmaking;drawing;illustrator;post-impressionism;fauvism;impressionism;neo-impressionism;symbolism (arts);cloisonnism;pont-aven school;synthetism;edwardian era;art nouveau;applied arts;decorative arts;gesamtkunstwerk;graphic arts;fine art;19th-century french painters;art nouveau illustrators;art nouveau painters;french illustrators;french printmakers;french poster artists;post-impressionist painters;paintings by henri de toulouse-lautrec;at the moulin rouge;édouard dujardin;works set in the moulin rouge;paintings set in cabarets;",2017,9,25,7,19,3,"Monday","2017-09-25T07:19:03Z",0.06872246696035242,0.04114906832298138,11.766,"f22e757b-8116-4496-bec4-ae93a4792c28","resourceVisited","impressionism",0
