"user_id","cookie_user","Item","title","description","resource_url","link","tags","Year","Month","Day","Hour","Minutes","Seconds","Day of Week","date","topic_coverage","view_coverage","weight","community_id","type","name","scope_topic_coverage"
"cd330929-4725-441b-8091-5e4581722bd5","68dad3e6-c9fd-7344-6e9d-4559f0986b13","759e2edc-d977-4a89-a020-576a9c922609","Regla de Barrow (Vitutor)","Teoría sobre integral definida para trabajar: Regla de Barrow.<br/><br/><p>Es un recurso de <a href='http://www.vitutor.com/' target='_blank'>vitutor.com</a>, una plataforma de teleformación diseñada para el aprendizaje en línea de distintas materias, fundamentalmente matemáticas.</p>","https://didactalia.net/comunidad/materialeducativo/recurso/regla-de-barrow-vitutor/759e2edc-d977-4a89-a020-576a9c922609","http://www.vitutor.com/integrales/definidas/regla_barrow.html","integral definida;regla de barrow;isaac barrow;barrow;ejercicios resueltos;bachillerato;teorema fundamental del cálculo;",2017,10,9,9,36,21,"Monday","2017-10-09T09:36:21Z",0.06872246696035242,0.007874015748031496,12.222,"f22e757b-8116-4496-bec4-ae93a4792c28","resourceVisited","",0.06872246696035242
"cd330929-4725-441b-8091-5e4581722bd5","3ef29bd8-0792-fba7-1790-eb7f45eb28d8","1905d734-c63a-40a5-a60f-d661848ac039","Atencion y discriminación visual con siluetas de Animales salvajes","<p>\r\n\tDejamos adem&aacute;s la plantilla editable para que hagas tus propias actividades de atenci&oacute;n. Encontrar figuras iguales a un modelo dado.<strong>INCLUIMOS PLANTILLA EDITABLE&nbsp;&nbsp;AL FINAL DE LA ENTRADA</strong></p>\r\n<p>\r\n\tLa realizaci&oacute;n de estas actividades consigue que nuestros alumnos fijen su atenci&oacute;n en un objeto determinado analizando su contorno de tal forma que aprenden a diferenciar los objetos sin estar dibujado con todas sus caracter&iacute;sticas solo el contorno. Podemos emplear para estas actividades personajes de comic o dibujos animados de los que ven habitualmente en casa para motivarlos.</p>\r\n<p>\r\n\tPara trabajar la percepci&oacute;n visual vamos a trabajar con siluetas para ello hemos preparado un video que debemos de visualizar y a continuaci&oacute;n trabajaremos esta ficha.</p>\r\n<p>\r\n\tEn el video vamos a visualizar las siluetas de diferentes animales salvajes y cuando nuestros alumnos hayan aprendido la relaci&oacute;n entre el animal salvaje y su silueta pasamos a trabajar con nuestra ficha en formato papel.</p>\r\n<p>\r\n\tEn esta actividad vamos a trabajar la atenci&oacute;n mantenida de nuestros alumnos y especialmente la discriminaci&oacute;n visual.</p>\r\n<p>\r\n\t<epfp>En esta actividad como&nbsp;novedad&nbsp;incluimos varios video de nuestro canal de youtube que apoyan el desarrollo de la misma.</epfp></p>\r\n<p>\r\n\t<strong>EJEMPLO DE LA ACTIVIDAD</strong></p>\r\n<p>\r\n\t&nbsp;</p>\r\n<p>\r\n\t&nbsp;<a href=""http://www.orientacionandujar.es/2013/09/20/atencion-y-discriminacion-visual-con-siluetas-de-animales-salvajes/atencion-mantenida-tacha-las-siluetas-igual-al-modelo-imagenes_05/"" rel=""attachment wp-att-23957"" target=""_blank""><img alt=""ATENCION MANTENIDA TACHA LAS siluetas igual al modelo imagenes_05"" height=""400"" src=""http://www.orientacionandujar.es/wp-content/uploads/2013/09/ATENCION-MANTENIDA-TACHA-LAS-siluetas-igual-al-modelo-imagenes_05-282x400.jpeg"" width=""282"" /></a><a href=""http://www.orientacionandujar.es/2013/09/20/atencion-y-discriminacion-visual-con-siluetas-de-animales-salvajes/atencion-mantenida-tacha-las-siluetas-igual-al-modelo-imagenes_03/"" rel=""attachment wp-att-23958"" target=""_blank""><img alt=""ATENCION MANTENIDA TACHA LAS siluetas igual al modelo imagenes_03"" height=""400"" src=""http://www.orientacionandujar.es/wp-content/uploads/2013/09/ATENCION-MANTENIDA-TACHA-LAS-siluetas-igual-al-modelo-imagenes_03-282x400.jpeg"" width=""282"" /></a><a href=""http://www.orientacionandujar.es/2013/09/20/atencion-y-discriminacion-visual-con-siluetas-de-animales-salvajes/atencion-mantenida-tacha-las-siluetas-igual-al-modelo-imagenes_04/"" rel=""attachment wp-att-23959"" target=""_blank""><img alt=""ATENCION MANTENIDA TACHA LAS siluetas igual al modelo imagenes_04"" height=""400"" src=""http://www.orientacionandujar.es/wp-content/uploads/2013/09/ATENCION-MANTENIDA-TACHA-LAS-siluetas-igual-al-modelo-imagenes_04-282x400.jpeg"" width=""282"" /></a></p>\r\n<p>\r\n\t&nbsp;</p>\r\n<p>\r\n\t&nbsp;</p>\r\n<p>\r\n\t&nbsp;</p>\r\n<p>\r\n\t&nbsp;</p>\r\n<p>\r\n\t&nbsp;</p>\r\n<p>\r\n\t&nbsp;</p>\r\n<p>\r\n\t&nbsp;</p>\r\n<p>\r\n\t&nbsp;</p>\r\n<p>\r\n\t&nbsp;</p>\r\n<p>\r\n\t&nbsp;</p>\r\n<p>\r\n\t&nbsp;</p>\r\n<p>\r\n\t&nbsp;</p>\r\n<p>\r\n\t&nbsp;</p>\r\n<p>\r\n\t&nbsp;</p>\r\n<p>\r\n\t&nbsp;</p>\r\n<p>\r\n\t&nbsp;</p>\r\n<p>\r\n\t&nbsp;</p>\r\n<p>\r\n\t&nbsp;</p>\r\n<p>\r\n\t&nbsp;</p>\r\n<p>\r\n\t&nbsp;</p>\r\n<p>\r\n\t&nbsp;</p>\r\n<p>\r\n\t&nbsp;</p>\r\n<p>\r\n\t&nbsp;</p>\r\n<p>\r\n\t&nbsp;</p>\r\n<p>\r\n\t&nbsp;</p>\r\n<p>\r\n\t&nbsp;</p>\r\n<p>\r\n\t&nbsp;</p>\r\n<p>\r\n\t&nbsp;</p>\r\n<p>\r\n\t&nbsp;</p>\r\n<p>\r\n\t&nbsp;</p>\r\n<p>\r\n\t&nbsp;</p>\r\n<p>\r\n\t&nbsp;</p>\r\n<p>\r\n\t&nbsp;</p>\r\n<p>\r\n\t&nbsp;</p>\r\n<p>\r\n\t&nbsp;</p>\r\n<p>\r\n\t&nbsp;</p>\r\n<p>\r\n\t&nbsp;</p>\r\n<p>\r\n\t&nbsp;</p>\r\n<p>\r\n\t&nbsp;</p>\r\n<p>\r\n\t&nbsp;</p>\r\n<p>\r\n\t&nbsp;</p>\r\n<p>\r\n\t&nbsp;</p>\r\n<p>\r\n\t&nbsp;</p>\r\n<p>\r\n\t&nbsp;</p>\r\n<p>\r\n\t&nbsp;</p>\r\n<p>\r\n\t&nbsp;</p>\r\n<p>\r\n\t<strong>DESCARGATE LA FICHA EN PDF</strong></p>\r\n<p>\r\n\t&nbsp;</p>\r\n<p>\r\n\t&nbsp;</p>\r\n<p>\r\n\t&nbsp;</p>\r\n<p>\r\n\t&nbsp;</p>\r\n<p>\r\n\t<a href=""http://www.orientacionandujar.es/2013/09/20/atencion-y-discriminacion-visual-con-siluetas-de-animales-salvajes/atencion-mantenida-tacha-las-siluetas-igual-al-modelo-2/"" rel=""attachment wp-att-23960"" target=""_blank"">ATENCION MANTENIDA TACHA LAS siluetas igual al modelo</a></p>\r\n<p>\r\n\t&nbsp;</p>\r\n<p>\r\n\t&nbsp;</p>\r\n<h2>\r\n\t&nbsp;4 VIDEOS PARA TRABAJAR LAS SILUETAS</h2>\r\n<h2>\r\n\tEN NUESTRO CANAL</h2>\r\n<p>\r\n\t&nbsp;<a href=""http://www.orientacionandujar.es/?attachment_id=23962"" rel=""attachment wp-att-23961"" target=""_blank""><img alt=""ATENCION MANTENIDA TACHA LAS siluetas igual al modelo imagenes_02"" height=""400"" src=""http://www.orientacionandujar.es/wp-content/uploads/2013/09/ATENCION-MANTENIDA-TACHA-LAS-siluetas-igual-al-modelo-imagenes_02-282x400.jpeg"" width=""282"" /></a></p>\r\n<p>\r\n\t<a href=""http://www.orientacionandujar.es/2013/09/20/atencion-y-discriminacion-visual-con-siluetas-de-animales-salvajes/atencion-mantenida-siluetas-videos-de-apoyo/"" rel=""attachment wp-att-23962"" target=""_blank"">ATENCION MANTENIDA SILUETAS VIDEOS DE APOYO</a></p>\r\n","https://didactalia.net/comunidad/materialeducativo/recurso/atencion-y-discriminacion-visual-con-siluetas-de/1905d734-c63a-40a5-a60f-d661848ac039",,"discriminación;visual;siluetas;animales;atencion;ejemplo de la actividad;descargate la ficha en pdf;plantilla editable al final de la entrada;de la actividad;la ficha en pdf;figura;fondo;orientacion andujar;",2017,10,5,11,21,52,"Thursday","2017-10-05T11:21:52Z",0.06872246696035242,0.007936507936507936,26.246,"f22e757b-8116-4496-bec4-ae93a4792c28","resourceVisited","",0.06872246696035242
"cd330929-4725-441b-8091-5e4581722bd5","3ef29bd8-0792-fba7-1790-eb7f45eb28d8","4be3cc2d-47a2-4f6a-9b77-b2b12b37c60c","ACTIVIDADES DISLEXIA Completar palabras con sílabas dejamos Plantilla","<p>Cu&aacute;ndo sospechamos que nuestro hijo/a puede ser disl&eacute;xico podemos hacer una serie de <strong>actividades que mejorar&aacute;n su nivel lectoescritor</strong>. Tanto si al final se confirma el diagn&oacute;stico como si se descarta, en cualquier caso ser&aacute;n muy beneficiosas para <strong>facilitar el aprendizaje de la lectoescritura</strong>.</p>\r\n\r\n<p>Lo importante es realizar este tipo de entrenamiento antes de los 8 &oacute; 9 a&ntilde;os, preferiblemente durante el &uacute;ltimo curso de la etapa pre-escolar y el primer curso de la Educaci&oacute;n Primaria, sin tener en cuenta que desde el colegio a&uacute;n no exista alarma.<br />\r\nEn cualquier caso, <strong>no podemos esperar a que se confirme el diagn&oacute;stico</strong> porque habremos perdido la mejor &eacute;poca para intervenir y preparar al ni&ntilde;o/a para el aprendizaje de la lectura, y tendremos un problema serio si empieza 3&ordm; de primaria y a&uacute;n no hemos intervenicdo la dislexia, ya que el aumento de exigencias escolares har&aacute; visible el problema.</p>\r\n\r\n<p>En estas actividades nuestros alumnos deben de selecionar entre tres s&iacute;labas la que es correcta para la palabra que le hemos dado.</p>\r\n\r\n<p>Dejamos plantilla en formato editable para hacer vuestras propias actividades.</p>\r\n\r\n<p><br />\r\n<a href=""http://www.orientacionandujar.es/2014/01/20/actividades-para-trabajar-la-dislexia-distinguimos-palabras-inventadas/es-dislexico-mi-hijo_8lzjt/"" rel=""attachment wp-att-27371"" target=""_blank""><img alt=""es-dislexico-mi-hijo_8lzjt"" src=""http://www.orientacionandujar.es/wp-content/uploads/2014/01/es-dislexico-mi-hijo_8lzjt-150x150.jpg"" style=""height:150px; width:150px"" /></a></p>\r\n\r\n<p><strong>Ejercicios de Conciencia Fonol&oacute;gica y sem&aacute;ntica</strong></p>\r\n\r\n<p>Pretenden mejorar la habilidad de representar y operar mentalmente con los sonidos del lenguaje, influyendo directamente en los procesos de decodificaci&oacute;n lectora, as&iacute; como ejercitan la memoria de trabajo u operativa, directamente relacionada con el aprendizaje lectoescritor.</p>\r\n\r\n<p>Os dejamos esta recopilacion de posibles ejercicios que podemos hacer sacada de <a href=""http://orientacioncastrillon.wordpress.com/"" target=""_blank"">http://orientacioncastrillon.wordpress.com/.</a></p>\r\n\r\n<p><a href=""http://www.orientacionandujar.es/2012/02/23/11-guias-utiles-para-docentes-que-trabajan-con-alumnos-de-nee/"" rel=""bookmark"" target=""_blank"">Guias &Uacute;tiles para docentes </a>DISLEXIA</p>\r\n\r\n<p><a href=""http://www.orientacionandujar.es/2014/01/20/actividades-para-trabajar-la-dislexia-distinguimos-palabras-inventadas/ejercicios-para-trabajar-la-dislexia/"" rel=""attachment wp-att-27364"" target=""_blank"">ejercicios-para-trabajar-la-dislexia</a></p>\r\n\r\n<p>Nuestros alumnos deben de distinguir entre dos palabras muy similares siendo una de ellas inventada</p>\r\n\r\n<p><strong>EJEMPLO DE LA ACTIVIDAD</strong></p>\r\n\r\n<p><strong>FICHAS DE ACTIVIDADES</strong></p>\r\n\r\n<p><a href=""http://www.orientacionandujar.es/?attachment_id=27505"" rel=""attachment wp-att-27505"" target=""_blank""><img alt=""Ejercicios para niños con dislexia Completar palabras con sílabas imagen1"" src=""http://www.orientacionandujar.es/wp-content/uploads/2014/01/Ejercicios-para-ni%C3%B1os-con-dislexia-Completar-palabras-con-s%C3%ADlabas-imagen1-400x283.jpg"" style=""height:283px; width:400px"" /></a> <a href=""http://www.orientacionandujar.es/?attachment_id=27506"" rel=""attachment wp-att-27506"" target=""_blank""><img alt=""Ejercicios para niños con dislexia Completar palabras con sílabas imagen 2"" src=""http://www.orientacionandujar.es/wp-content/uploads/2014/01/Ejercicios-para-ni%C3%B1os-con-dislexia-Completar-palabras-con-s%C3%ADlabas-imagen-2-400x283.jpg"" style=""height:283px; width:400px"" /></a> <a href=""http://www.orientacionandujar.es/?attachment_id=27507"" rel=""attachment wp-att-27507"" target=""_blank""><img alt=""Ejercicios para niños con dislexia Completar palabras con sílabas imagen 3"" src=""http://www.orientacionandujar.es/wp-content/uploads/2014/01/Ejercicios-para-ni%C3%B1os-con-dislexia-Completar-palabras-con-s%C3%ADlabas-imagen-3-400x283.jpg"" style=""height:283px; width:400px"" /></a> <a href=""http://www.orientacionandujar.es/?attachment_id=27508"" rel=""attachment wp-att-27508"" target=""_blank""><img alt=""Ejercicios para niños con dislexia Completar palabras con sílabas imagen 4"" src=""http://www.orientacionandujar.es/wp-content/uploads/2014/01/Ejercicios-para-ni%C3%B1os-con-dislexia-Completar-palabras-con-s%C3%ADlabas-imagen-4-400x283.jpg"" style=""height:283px; width:400px"" /></a></p>\r\n\r\n<p><strong>DESCARGATE LA ACTIVIDAD EN PDF</strong></p>\r\n\r\n<p><strong>&nbsp;&nbsp; <a href=""http://www.orientacionandujar.es/?attachment_id=27511"" rel=""attachment wp-att-27511"" target=""_blank"">Ejercicios para ni&ntilde;os con dislexia Completar palabras con s&iacute;labas</a>&nbsp;&nbsp;&nbsp; </strong><br />\r\n&nbsp;</p>\r\n\r\n<p><strong>OS DEJAMOS LA PLANTILLA EN FORMATO EDITABLE</strong></p>\r\n\r\n<p><a href=""http://www.orientacionandujar.es/?attachment_id=27510"" rel=""attachment wp-att-27510"" target=""_blank""><img alt=""Ejercicios dislexia Completar palabras con sílabas plantilla imagen"" src=""http://www.orientacionandujar.es/wp-content/uploads/2014/01/Ejercicios-dislexia-Completar-palabras-con-s%C3%ADlabas-plantilla-imagen-400x283.jpg"" style=""height:283px; width:400px"" /></a></p>\r\n\r\n<p><strong>DESCARGATE LA PLANTILLA EN PDF</strong></p>\r\n\r\n<p><a href=""http://www.orientacionandujar.es/?attachment_id=27509"" rel=""attachment wp-att-27509"" target=""_blank"">Ejercicios dislexia Completar palabras con s&iacute;labas plantilla</a></p>\r\n\r\n<p><strong>MATERIALES DISLEXIA ANTERIORMENTE PUBLICADOS</strong></p>\r\n\r\n<p><a href=""http://www.orientacionandujar.es/2013/12/12/ejercicios-para-ninos-con-dislexia-omision-de-silabas/"" rel=""bookmark"" target=""_blank"">Ejercicios para ni&ntilde;os con dislexia Omisi&oacute;n de s&iacute;labas</a></p>\r\n\r\n<p><a href=""http://www.orientacionandujar.es/2013/12/17/ejercicios-para-ninos-con-dislexia-sustituicion-de-silabas-y-creacion-de-palabras/"" rel=""bookmark"" target=""_blank"">Ejercicios para ni&ntilde;os con dislexia sustituci&oacute;n de s&iacute;labas y creaci&oacute;n de palabras</a></p>\r\n\r\n<p><a href=""http://www.orientacionandujar.es/2014/01/20/actividades-para-trabajar-la-dislexia-distinguimos-palabras-inventadas/"" rel=""bookmark"" target=""_blank"">ACTIVIDADES&nbsp; DISLEXIA distinguimos palabras inventadas</a></p>\r\n","https://didactalia.net/comunidad/materialeducativo/recurso/actividades-dislexia-completar-palabras-con/4be3cc2d-47a2-4f6a-9b77-b2b12b37c60c",,"dislexia completar;sílabas;dejamos;plantilla;actividades;orientacioncastrillon.wordpress.com;guias útiles para docentes;ejercicios-para-trabajar-la-dislexia;facilitar el aprendizaje de la lectoescritura;no podemos esperar a que se confirme el diagnóstico;dislexia;palabras;encadenadas;completar;descargate la actividad en pdf;descargate la plantilla en pdf;educación primaria;juego;fichas de actividades;",2017,10,5,11,20,38,"Thursday","2017-10-05T11:20:38Z",0.06872246696035242,0.016000000000000007,27.783,"f22e757b-8116-4496-bec4-ae93a4792c28","resourceVisited","",0.06872246696035242
"cd330929-4725-441b-8091-5e4581722bd5","3ef29bd8-0792-fba7-1790-eb7f45eb28d8","4be3cc2d-47a2-4f6a-9b77-b2b12b37c60c","ACTIVIDADES DISLEXIA Completar palabras con sílabas dejamos Plantilla","<p>Cu&aacute;ndo sospechamos que nuestro hijo/a puede ser disl&eacute;xico podemos hacer una serie de <strong>actividades que mejorar&aacute;n su nivel lectoescritor</strong>. Tanto si al final se confirma el diagn&oacute;stico como si se descarta, en cualquier caso ser&aacute;n muy beneficiosas para <strong>facilitar el aprendizaje de la lectoescritura</strong>.</p>\r\n\r\n<p>Lo importante es realizar este tipo de entrenamiento antes de los 8 &oacute; 9 a&ntilde;os, preferiblemente durante el &uacute;ltimo curso de la etapa pre-escolar y el primer curso de la Educaci&oacute;n Primaria, sin tener en cuenta que desde el colegio a&uacute;n no exista alarma.<br />\r\nEn cualquier caso, <strong>no podemos esperar a que se confirme el diagn&oacute;stico</strong> porque habremos perdido la mejor &eacute;poca para intervenir y preparar al ni&ntilde;o/a para el aprendizaje de la lectura, y tendremos un problema serio si empieza 3&ordm; de primaria y a&uacute;n no hemos intervenicdo la dislexia, ya que el aumento de exigencias escolares har&aacute; visible el problema.</p>\r\n\r\n<p>En estas actividades nuestros alumnos deben de selecionar entre tres s&iacute;labas la que es correcta para la palabra que le hemos dado.</p>\r\n\r\n<p>Dejamos plantilla en formato editable para hacer vuestras propias actividades.</p>\r\n\r\n<p><br />\r\n<a href=""http://www.orientacionandujar.es/2014/01/20/actividades-para-trabajar-la-dislexia-distinguimos-palabras-inventadas/es-dislexico-mi-hijo_8lzjt/"" rel=""attachment wp-att-27371"" target=""_blank""><img alt=""es-dislexico-mi-hijo_8lzjt"" src=""http://www.orientacionandujar.es/wp-content/uploads/2014/01/es-dislexico-mi-hijo_8lzjt-150x150.jpg"" style=""height:150px; width:150px"" /></a></p>\r\n\r\n<p><strong>Ejercicios de Conciencia Fonol&oacute;gica y sem&aacute;ntica</strong></p>\r\n\r\n<p>Pretenden mejorar la habilidad de representar y operar mentalmente con los sonidos del lenguaje, influyendo directamente en los procesos de decodificaci&oacute;n lectora, as&iacute; como ejercitan la memoria de trabajo u operativa, directamente relacionada con el aprendizaje lectoescritor.</p>\r\n\r\n<p>Os dejamos esta recopilacion de posibles ejercicios que podemos hacer sacada de <a href=""http://orientacioncastrillon.wordpress.com/"" target=""_blank"">http://orientacioncastrillon.wordpress.com/.</a></p>\r\n\r\n<p><a href=""http://www.orientacionandujar.es/2012/02/23/11-guias-utiles-para-docentes-que-trabajan-con-alumnos-de-nee/"" rel=""bookmark"" target=""_blank"">Guias &Uacute;tiles para docentes </a>DISLEXIA</p>\r\n\r\n<p><a href=""http://www.orientacionandujar.es/2014/01/20/actividades-para-trabajar-la-dislexia-distinguimos-palabras-inventadas/ejercicios-para-trabajar-la-dislexia/"" rel=""attachment wp-att-27364"" target=""_blank"">ejercicios-para-trabajar-la-dislexia</a></p>\r\n\r\n<p>Nuestros alumnos deben de distinguir entre dos palabras muy similares siendo una de ellas inventada</p>\r\n\r\n<p><strong>EJEMPLO DE LA ACTIVIDAD</strong></p>\r\n\r\n<p><strong>FICHAS DE ACTIVIDADES</strong></p>\r\n\r\n<p><a href=""http://www.orientacionandujar.es/?attachment_id=27505"" rel=""attachment wp-att-27505"" target=""_blank""><img alt=""Ejercicios para niños con dislexia Completar palabras con sílabas imagen1"" src=""http://www.orientacionandujar.es/wp-content/uploads/2014/01/Ejercicios-para-ni%C3%B1os-con-dislexia-Completar-palabras-con-s%C3%ADlabas-imagen1-400x283.jpg"" style=""height:283px; width:400px"" /></a> <a href=""http://www.orientacionandujar.es/?attachment_id=27506"" rel=""attachment wp-att-27506"" target=""_blank""><img alt=""Ejercicios para niños con dislexia Completar palabras con sílabas imagen 2"" src=""http://www.orientacionandujar.es/wp-content/uploads/2014/01/Ejercicios-para-ni%C3%B1os-con-dislexia-Completar-palabras-con-s%C3%ADlabas-imagen-2-400x283.jpg"" style=""height:283px; width:400px"" /></a> <a href=""http://www.orientacionandujar.es/?attachment_id=27507"" rel=""attachment wp-att-27507"" target=""_blank""><img alt=""Ejercicios para niños con dislexia Completar palabras con sílabas imagen 3"" src=""http://www.orientacionandujar.es/wp-content/uploads/2014/01/Ejercicios-para-ni%C3%B1os-con-dislexia-Completar-palabras-con-s%C3%ADlabas-imagen-3-400x283.jpg"" style=""height:283px; width:400px"" /></a> <a href=""http://www.orientacionandujar.es/?attachment_id=27508"" rel=""attachment wp-att-27508"" target=""_blank""><img alt=""Ejercicios para niños con dislexia Completar palabras con sílabas imagen 4"" src=""http://www.orientacionandujar.es/wp-content/uploads/2014/01/Ejercicios-para-ni%C3%B1os-con-dislexia-Completar-palabras-con-s%C3%ADlabas-imagen-4-400x283.jpg"" style=""height:283px; width:400px"" /></a></p>\r\n\r\n<p><strong>DESCARGATE LA ACTIVIDAD EN PDF</strong></p>\r\n\r\n<p><strong>&nbsp;&nbsp; <a href=""http://www.orientacionandujar.es/?attachment_id=27511"" rel=""attachment wp-att-27511"" target=""_blank"">Ejercicios para ni&ntilde;os con dislexia Completar palabras con s&iacute;labas</a>&nbsp;&nbsp;&nbsp; </strong><br />\r\n&nbsp;</p>\r\n\r\n<p><strong>OS DEJAMOS LA PLANTILLA EN FORMATO EDITABLE</strong></p>\r\n\r\n<p><a href=""http://www.orientacionandujar.es/?attachment_id=27510"" rel=""attachment wp-att-27510"" target=""_blank""><img alt=""Ejercicios dislexia Completar palabras con sílabas plantilla imagen"" src=""http://www.orientacionandujar.es/wp-content/uploads/2014/01/Ejercicios-dislexia-Completar-palabras-con-s%C3%ADlabas-plantilla-imagen-400x283.jpg"" style=""height:283px; width:400px"" /></a></p>\r\n\r\n<p><strong>DESCARGATE LA PLANTILLA EN PDF</strong></p>\r\n\r\n<p><a href=""http://www.orientacionandujar.es/?attachment_id=27509"" rel=""attachment wp-att-27509"" target=""_blank"">Ejercicios dislexia Completar palabras con s&iacute;labas plantilla</a></p>\r\n\r\n<p><strong>MATERIALES DISLEXIA ANTERIORMENTE PUBLICADOS</strong></p>\r\n\r\n<p><a href=""http://www.orientacionandujar.es/2013/12/12/ejercicios-para-ninos-con-dislexia-omision-de-silabas/"" rel=""bookmark"" target=""_blank"">Ejercicios para ni&ntilde;os con dislexia Omisi&oacute;n de s&iacute;labas</a></p>\r\n\r\n<p><a href=""http://www.orientacionandujar.es/2013/12/17/ejercicios-para-ninos-con-dislexia-sustituicion-de-silabas-y-creacion-de-palabras/"" rel=""bookmark"" target=""_blank"">Ejercicios para ni&ntilde;os con dislexia sustituci&oacute;n de s&iacute;labas y creaci&oacute;n de palabras</a></p>\r\n\r\n<p><a href=""http://www.orientacionandujar.es/2014/01/20/actividades-para-trabajar-la-dislexia-distinguimos-palabras-inventadas/"" rel=""bookmark"" target=""_blank"">ACTIVIDADES&nbsp; DISLEXIA distinguimos palabras inventadas</a></p>\r\n","https://didactalia.net/comunidad/materialeducativo/recurso/actividades-dislexia-completar-palabras-con/4be3cc2d-47a2-4f6a-9b77-b2b12b37c60c",,"dislexia completar;sílabas;dejamos;plantilla;actividades;orientacioncastrillon.wordpress.com;guias útiles para docentes;ejercicios-para-trabajar-la-dislexia;facilitar el aprendizaje de la lectoescritura;no podemos esperar a que se confirme el diagnóstico;dislexia;palabras;encadenadas;completar;descargate la actividad en pdf;descargate la plantilla en pdf;educación primaria;juego;fichas de actividades;",2017,10,5,11,20,24,"Thursday","2017-10-05T11:20:24Z",0.06872246696035242,0.008064516129032254,27.783,"f22e757b-8116-4496-bec4-ae93a4792c28","resourceVisited","",0.06872246696035242
"cd330929-4725-441b-8091-5e4581722bd5","68dad3e6-c9fd-7344-6e9d-4559f0986b13","f187d979-bc23-41dd-8aef-66e6ef8bb52a","Poster of Descartes","<p>René Descartes was a French philosopher whose work, La géométrie, includes his application of algebra to geometry from which we now have Cartesian geometry. His work had a great influence on both mathematicians and philosophers.</p>","https://didactalia.net/comunidad/materialeducativo/recurso/poster-of-descartes/f187d979-bc23-41dd-8aef-66e6ef8bb52a","http://www-history.mcs.st-and.ac.uk/Posters2/Descartes.html","descartes;rené;rené  textos narativos;rené descartes;",2017,10,5,7,41,19,"Thursday","2017-10-05T07:41:19Z",0.06872246696035242,0.008130081300813009,18.244,"f22e757b-8116-4496-bec4-ae93a4792c28","resourceVisited","",0.06872246696035242
"cd330929-4725-441b-8091-5e4581722bd5","279f1b9d-b3d1-53f0-cc84-651c822f03c3","6455604c-ecdd-4e93-a11a-1bdb001e7d31","Formulación y nomenclatura de Química Inorgánica (IES Politécnico de Cartagena)","<p><img alt=""Formulación y nomenclatura de Química Inorgánica (Politécnico Cartagena)"" src=""https://contentmapas.didactalia.net/imagenes/Usuarios/ImagenesCKEditor/5d1dada8-e23b-499e-aa70-66ad03aedbc4/2263d7ad-2964-49e8-a911-8ae7696ffb5e.jpg"" style=""height:388px; width:300px"" title=""Formulación y nomenclatura de Química Inorgánica (Politécnico Cartagena)"" />Cayetano Guti&eacute;rrez P&eacute;rez,&nbsp;Catedr&aacute;tico de F&iacute;sica y Qu&iacute;mica del&nbsp;IES Polit&eacute;cnico de Cartagena, repasa en estos apuntes la fomulaci&oacute;n y nomenclatura de los compuestos inorg&aacute;nicos.</p>\n\n<p>Abarca con diversos ejemplos la formulaci&oacute;n de:&nbsp;compuestos binarios (&oacute;xidos, sales binarias, hidruros met&aacute;licos, per&oacute;xidos), hidr&oacute;xidos, &aacute;cidos (hidr&aacute;cidos, ox&aacute;cidos) y&nbsp;sales (sales neutras y sales &aacute;cidas).</p>\n","https://didactalia.net/comunidad/materialeducativo/recurso/formulacion-y-nomenclatura-de-quimica-inorganica/6455604c-ecdd-4e93-a11a-1bdb001e7d31","http://www.politecnicocartagena.es/wp-content/uploads/2012/11/1bacform_y_nomen_quim_imorg.pdf","química inorgánica;nomenclatura química de los compuestos inorgánicos;nomenclatura química;compuestos inorgánicos;oxígeno;nomenclatura iupac;óxidos;sistema de nomenclatura stock;compuesto binario;sales binarias;peróxidos;hidruros;hidróxidos;ácidos;oxácidos;hidrácidos;sal (química);sal;sales neutras;sales ácidas;sal ácida;hidruros metálicos;",2017,10,5,6,0,57,"Thursday","2017-10-05T06:00:57Z",0.06872246696035242,0.010059612518628917,13.468,"f22e757b-8116-4496-bec4-ae93a4792c28","resourceVisited","",0.06872246696035242
